#漢字	音標	解釋
癮	qɯn (於謹切 隱聲 文1)	原無阝旁，此爲集韻異體
癯	ɡʷa (其俱切 瞿聲 魚)	同臞
癰	qoŋ (於容切 邕聲 東)	
癱	n̥ʰaːn (他干切 暵聲 元1)	見金匱，字彚方收，疑爲痑後起字古當音lhaan
癲	tiːn (都年切 眞聲 眞1)	同瘨見難經
癶	paːd (北末切 癶聲 月1)	
癸	kʷilʔ (居誄切 癸聲 脂1)	戴侗雲戣初文；甲文象二工（金文或變二木）相交以度圜，本規初文
癹	pʰaːd (普活切 癹聲 月1)	注說文讀此
癹	baːd (蒲撥切 癹聲 月1)	
登	tɯːŋ (都縢切 登聲 蒸)	
發	pad (方伐切 癹聲 月1)	
白	braːɡ (傍陌切 白聲 鐸)	
百	praːɡ (博陌切 白聲 鐸)	
皀	pqrɯɡ (彼側切 皀聲 職)	
皀	pqrɯb (彼及切 皀聲 緝1)	
皀	krɯb (居立切 皀聲 緝1)	
皀	qʰaŋ (許良切 皀聲 陽)	
皁	zuːʔ (昨早切 早聲 幽1)	說文作草，此由早加撇轉註分化
皂	zuːʔ (昨早切 早聲 幽1)	皁字注俗體，折筆以轉註分化
皃	mreːwɢs (莫敎切 皃聲 豹2)	
皃	mreːwɢ (莫角切 皃聲 藥2)	
的	pleːwɢ (都歷切 勺聲 藥2)	
皆	kriːl (古諧切 皆聲 脂1)	
皇	ɡʷaːŋ (胡光切 王聲 陽)	禮王制鄭注冕屬，金文象羽冠，王聲；或雲象日射輝則爲暀晃初文
皉	sheːʔ (千禮切 此聲 支)	
皋	kuː (古勞切 皋聲 幽1)	同臯
皎	keːwʔ (古了切 交聲 宵2)	
皏	pʰreːŋʔ (普幸切 并聲 耕)	見素問
皓	ɡuːʔ (下老切 告聲 幽1)	小爾雅，集韻同顥
皔	ɡaːnʔ (胡笴切 干聲 元1)	
皕	prɯɡ (彼側切 白聲 職)	
皖	ɦŋoːnʔ (胡管切 元聲 元3)	原作晥，漢縣，漢書作睆，後漢書作皖或晥
皖	ɦŋroːnʔ (戸板切 元聲 元3)	詩作睆
皙	seːɡ (先擊切 析聲 錫)	
皚	ŋɯːl (五來切 豈聲 微1)	
皛	pʰraːɡ (普伯切 白聲 鐸)	
皛	ɡeːwʔ (胡了切 皛聲 宵2)	
皝	ɡʷaːŋʔ (胡廣切 王聲 陽)	
皟	shreːɡ (楚革切 朿聲 錫)	見管子
皠	shluːlʔ (七罪切 崔聲 微2)	
皢	hŋeːwʔ (馨皛切 垚聲 宵2)	
皣	ɢʷrab (筠輒切 曄聲 盍1)	
皤	paːl (博禾切 番聲 歌1)	
皤	baːl (薄波切 番聲 歌1)	
皦	kleːwʔ (古了切 敫聲 宵2)	
皪	reːwɢ (郎擊切 樂聲 藥2)	見漢書
皫	pʰrewʔ (滂表切 麃聲 宵2)	
皫	pʰewʔ (敷沼切 麃聲 宵2)	
皭	ʔsewɢs (子肖切 爵聲 豹2)	
皭	zewɢ (在爵切 爵聲 藥2)	
皮	bral (符羈切 皮聲 歌1)	
皯	kaːnʔ (古旱切 干聲 元1)	
皰	pʰruːs (匹皃切 勹聲 幽1)	
皰	bruːs (防敎切 勹聲 幽1)	
皴	shlun (七倫切 允聲 文2)	
皵	shaɡ (七雀切 昔聲 鐸)	見爾雅
皵	shjaːɡ (七迹切 昔聲 鐸)	見爾雅
皷	kʷaːʔ (公戸切 鼓聲 魚)	見漢碑
皸	kun (舉云切 軍聲 文2)	見漢書
皸	kuns (居運切 軍聲 文2)	見漢書
皺	ʔsrus (側救切 芻聲 幽1)	
皻	ʔsraː (側加切 且聲 魚)	
皽	tjaʀ (止遙切 旦聲 宵1)	見禮記
皽	tanʔ (知演切 旦聲 元1)	
皽	tjanʔ (旨善切 旦聲 元1)	
皾	l'oːɡ (徒谷切 儥聲 屋)	方言皮在左
皿	maŋʔ (武永切 皿聲 陽)	
盂	ɢʷa (羽俱切 于聲 魚)	
盃	plɯː (布回切 不聲 之)	俗同桮
盄	tjiw (止遙切 弔聲 幽3)	
盅	tʰuŋ (敕中切 中聲 終)	後作沖，虛也
盅	duŋ (直弓切 中聲 終)	
盅	tjoŋ (職容切 中聲 東)	鍾今字
盆	bɯːn (蒲奔切 分聲 文1)	
盈	leŋ (以成切 盈聲 耕)	
盉	ɡoːl (戸戈切 禾聲 歌3)	
盉	ɡoːls (胡臥切 禾聲 歌3)	
益	qleɡ (伊昔切 益聲 錫)	
盋	poːd (北末切 犮聲 月3)	同鉢集韻爲正體
盌	qoːnʔ (烏管切 夗聲 元3)	同椀
盍	ɡaːb (胡臘切 盍聲 盍1)	
盎	qaːŋʔ (烏朗切 央聲 陽)	
盎	qaːŋs (烏浪切 央聲 陽)	
盒	ɡuːb (侯閤切 合聲 緝3)	
盓	qʷaː (哀都切 于聲 魚)	
盔	km̥ʰɯː (苦回切 灰聲 之)	古稱鍪
盖	kaːbs (古太切 盍聲 蓋1)	蓋俗字
盛	djeŋ (是征切 成聲 耕)	
盛	djeŋs (承正切 成聲 耕)	
盜	daːws (徒到切 盜聲 宵1)	
盝	roːɡ (盧谷切 录聲 屋)	見考工記
盞	ʔsreːnʔ (阻限切 戔聲 元2)	同琖見方言
盟	mraŋ (武兵切 明聲 陽)	
盟	mraːŋs (莫更切 明聲 陽)	
盠	reːlʔ (盧啓切 彖聲 歌2)	蠡分化字
盠	reːl (郎奚切 蠡聲 歌2)	見金文
盡	ʔslinʔ (即忍切 盡聲 眞1)	
盡	zlinʔ (慈忍切 盡聲 眞1)	
監	kraːm (古銜切 監聲 談1)	鑑初文，象人俯視皿水察容（林義光陳獨秀說），非形聲字
監	kraːms (格懺切 監聲 談1)	
盤	baːn/blaːn (薄官切 般聲 元1)	籀文槃
盥	koːnʔ (古滿切 盥聲 元3)	
盥	koːns (古玩切 盥聲 元3)	
盦	qɯːm (烏含切 今聲 侵1)	
盦	qaːb (安盍切 今聲 盍1)	
盧	b·raː (落胡切 虍聲 魚)	
盨	sraʔ (踈舉切 須聲 魚)	
盩	tu (張流切 盩聲 幽1)	
盪	l̥ʰaːŋ (吐郎切 昜聲 陽)	
盪	l̥ʰaːŋs (他浪切 昜聲 陽)	
盪	l'aːŋʔ (徒朗切 昜聲 陽)	
盬	kaː (古胡切 古聲 魚)	
盬	kaːʔ (公戸切 古聲 魚)	
目	muɡ (莫六切 目聲 覺1)	
盯	rteŋʔ (張梗切 丁聲 耕)	變音
盯	rdeŋ (直庚切 丁聲 耕)	
盰	kaːns (古案切 干聲 元1)	
盱	qʰʷa (況于切 于聲 魚)	
盲	mraːŋ (武庚切 亡聲 陽)	
直	dɯɡ (除力切 直聲 職)	金文象目測枉材以取直而會意
盵	kʰɯds (去既切 乞聲 隊1)	依巾箱本校作日旁
盷	ɡʷiːn (胡涓切 勻聲 眞1)	
相	slaŋ (息良切 相聲 陽)	
相	slaŋs (息亮切 相聲 陽)	
盹	tuːnʔ (丁本切 屯聲 文2)	頓晚起分化字，五音集韻造爲目合字，丁本切
盹	tjuns (之閏切 屯聲 文2)	
盻	ŋeːs (五計切 兮聲 支)	
盻	ɢeːs (胡計切 兮聲 支)	
盼	pʰrɯːns (匹莧切 分聲 文1)	
盾	l'uːnʔ (徒損切 盾聲 文2)	
盾	ɦljunʔ (食尹切 盾聲 文2)	
盿	mrɯn (武巾切 文聲 文1)	
省	sreŋʔ (所景切 省聲 耕)	甲金文生省聲
省	sleŋʔ (息井切 省聲 耕)	
眂	ɡje (是支切 氏聲 支)	
眂	ɡils (常利切 氏聲 脂1)	視字古文
眄	meːnʔ (彌殄切 丏聲 元2)	
眄	meːns (莫甸切 丏聲 元2)	
眅	pʰraːn (普班切 反聲 元1)	
眅	pʰraːnʔ (普板切 反聲 元1)	
眇	mewʔ (亡沼切 小聲 宵2)	
眈	ʔl'uːm (丁含切 冘聲 侵3)	
眈	ʔl'uːmʔ (都感切 冘聲 侵3)	由耽依集韻校改
眈	l'uːm (徒含切 冘聲 侵3)	
眉	mril (武悲切 眉聲 脂1)	
眊	maːws (莫報切 毛聲 宵1)	
眊	mraːwɢ (莫角切 毛聲 藥1)	
看	kʰaːn (苦寒切 看聲 元1)	
看	kʰaːns (苦旰切 看聲 元1)	
県	keːw (古堯切 県聲 宵2)	原下爲巛象倒懸首通作梟
眎	ɡljilʔ (承矢切 示聲 脂1)	同眡古文
眎	ɡljils (常利切 示聲 脂1)	視古文
眎	ɢljils (神至切 示聲 脂1)	視古文
眏	qaːŋ (烏郎切 央聲 陽)	
眐	tjeŋ (諸盈切 正聲 耕)	見楚辭哀時命
眑	qrɯːw (於交切 幼聲 幽2)	
眑	qrɯwʔ (於糾切 幼聲 幽2)	見漢書
眒	hlin (失人切 申聲 眞1)	見史記
眒	hlins (試刃切 申聲 眞1)	見史記
眓	qʰʷaːd (呼括切 戉聲 月1)	
眔	l'uːb (達合切 眔聲 緝3)	甲文象目流淚，爲涙初文（高鴻縉說）
眕	kljɯnʔ (章忍切 疹聲 文1)	
眗	ko (舉朱切 句聲 侯)	
眙	l̥ʰɯs (丑吏切 台聲 之)	
眙	lɯ (與之切 台聲 之)	
眚	sreŋʔ (所景切 生聲 耕)	
眛	maːds (莫貝切 末聲 祭1)	校本改眜
眛	mɯːds (莫佩切 未聲 隊1)	
眜	maːd (莫撥切 末聲 月1)	
眝	daʔ (直呂切 宁聲 魚)	
眞	ʔljin (職鄰切 眞聲 眞1)	原側鄰切依韻目改。金文象以匕充填鼎實爲填初文，充實引指眞實不虛
眠	miːn (莫賢切 民聲 眞1)	
眡	tiːl (都奚切 氐聲 脂1)	
眡	djilʔ (承矢切 氐聲 脂1)	
眢	qoːn (一丸切 夗聲 元3)	
眢	qon (於袁切 夗聲 元3)	
眣	ʔr'aːd (陟鎋切 失聲 月1)	原注見聲類
眣	l'iːɡ (徒結切 失聲 質2)	
眣	l̥ʰiɡ (丑栗切 失聲 質2)	
眥	zeːs (在詣切 此聲 支)	
眥	zes (疾智切 此聲 支)	
眦	zreːs (士懈切 此聲 支)	見漢書。士原誤七，依校本改
眧	tʰjewʔ (尺沼切 刀聲 宵2)	
眨	sproːb (側洽切 乏聲 盍3)	
眩	ɡʷeːn (胡涓切 玄聲 元2)	
眩	ɡʷeːn (黄練切 玄聲 元2)	
眭	ɡʷeː (戸圭切 圭聲 支)	見淮南子
眭	sqʰʷe (息爲切 圭聲 支)	漢姓
眭	qʰʷe (許規切 圭聲 支)	見淮南子
眭	qʰʷi (許維切 圭聲 脂2)	見淮南子
眮	doːŋ (徒紅切 同聲 東)	
眮	doːŋʔ (徒揔切 同聲 東)	
眮	doːŋs (徒弄切 同聲 東)	
眯	miːʔ (莫禮切 米聲 脂2)	
眱	lil (以脂切 夷聲 脂1)	集韻又田黎切說文方言作睇
眲	njɯs (仍吏切 耳聲 之)	
眲	rnɯːɡ (尼戹切 耳聲 職)	見方言
眳	meŋʔ (亡井切 名聲 耕)	
眳	meːŋʔ (莫迥切 名聲 耕)	
眴	qʰʷiːns (許縣切 勻聲 眞1)	說文或體
眴	ɡʷiːns (黄練切 勻聲 眞1)	說文或體
眴	sqʰʷin (相倫切 勻聲 眞1)	見班固賦
眴	qʰʷjins (舒閏切 勻聲 眞1)	同瞚見九章，或爲訓讀
眴	ŋʷjin (如勻切 勻聲 眞1)	同瞤或爲訓讀
眵	ʔljjal (章移切 多聲 歌1)	
眵	l̥ʰjal (叱支切 多聲 歌1)	
眶	kʰʷaŋ (去王切 王聲 陽)	
眷	krons (居倦切 龹聲 元3)	
眸	mu (莫浮切 牟聲 幽1)	
眹	l'ɯnʔ (直引切 朕聲 文1)	見周禮鄭注，莊子通朕
眺	l̥ʰeːws (他弔切 兆聲 宵2)	
眻	laŋ (與章切 羊聲 陽)	
眻	laŋs (餘亮切 羊聲 陽)	
眼	ŋrɯːnʔ (五限切 艮聲 文1)	
眽	mreːɡ (莫獲切 派聲 錫)	
睄	sreːws (所敎切 肖聲 宵2)	
睅	ɡʷranʔ (戸板切 干聲 元1)	
睆	ɦŋroːnʔ (戸板切 元聲 元3)	
睇	tʰiːl (土雞切 弟聲 脂1)	
睇	diːls (特計切 弟聲 脂1)	
睈	l̥ʰeŋʔ (丑郢切 呈聲 耕)	
睉	zoːl (昨禾切 坐聲 歌3)	
睊	kʷeːn (古玄切 肙聲 元2)	
睊	kʷeːns (古縣切 肙聲 元2)	
睋	ŋaːl (五何切 我聲 歌1)	見班固賦
睍	ɡeːnʔ (胡典切 見聲 元2)	
睎	hlɯl (香衣切 希聲 微1)	
睒	l̥ʰaːms (吐濫切 炎聲 談1)	余校以爲應刪
睒	hljamʔ (失冉切 炎聲 談1)	
睔	ɡ·ruːnʔ (盧本切 侖聲 文2)	
睔	kuːns (古困切 侖聲 文2)	
睔	ɡuːnʔ (胡本切 侖聲 文2)	
睕	qoːns (烏貫切 夗聲 元3)	
睕	qonʔ (於阮切 夗聲 元3)	
睕	qoːd (烏括切 夗聲 月3)	
睖	r̥ʰɯŋ (丑升切 夌聲 蒸)	
睗	hljeɡ (施隻切 易聲 錫)	
睘	ɡʷeŋ (渠營切 睘聲 耕)	
睚	ŋreːs (五懈切 圭聲 支)	
睛	ʔsleŋ (子盈切 生聲 耕)	
睛	shleŋʔ (七靜切 生聲 耕)	
睜	zeŋʔ (疾郢切 爭聲 耕)	
睞	rɯːs (洛代切 來聲 之)	
睟	suds (雖遂切 卒聲 隊2)	見孟子
睠	krons (居倦切 卷聲 元3)	同眷見詩小雅
睡	djols (是僞切 垂聲 歌3)	
睢	qʰʷel (許規切 唯聲 歌2)	
睢	sqʰʷil (息遺切 唯聲 脂1)	
睢	qʰʷi (許維切 唯聲 脂1)	
睢	qʰʷils (香季切 唯聲 脂1)	
督	ʔl'uːwɢ (冬毒切 尗聲 覺1)	
睥	pʰeːs (匹詣切 卑聲 支)	
睦	mluɡ (莫六切 坴聲 幽1)	古文從囧圥聲
睨	ŋeːs (五計切 兒聲 支)	見淮南子
睩	roːɡ (盧谷切 录聲 屋)	
睪	neb (尼輒切 幸聲 盍2)	
睪	laːɡ (羊益切 睪聲 鐸)	
睫	ʔseb (即葉切 疌聲 盍2)	見釋名
睬	shɯːʔ (倉宰切 采聲 之)	採採晚起分化字
睰	mrɯːd (莫八切 睰聲 物1)	
睲	seŋʔ (息井切 生聲 耕)	
睲	seːŋs (蘇佞切 生聲 耕)	
睳	qʰʷeː (呼攜切 圭聲 支)	
睴	kuːns (古困切 軍聲 文2)	
睴	ɡuːnʔ (胡本切 軍聲 文2)	
睵	ʔsɯː (祖才切 𢦏聲 之)	
睵	shɯː (倉才切 𢦏聲 之)	
睹	taːʔ (當古切 者聲 魚)	同覩
睺	ɡoː (戶鉤切 侯聲 侯)	
睺	ɡoːs (胡遘切 侯聲 侯)	
睼	tʰeːns (他甸切 是聲 元2)	讀若瑱
睽	kʰʷiːl (苦圭切 癸聲 脂1)	
睾	kuː (古勞切 皋聲 幽1)	皐字注俗體，見靈樞
睿	ɢʷeds (以芮切 睿聲 祭2)	古文叡
瞀	moːɡs (莫候切 矛聲 竇)	
瞀	mroːɡ (莫角切 矛聲 屋)	
瞁	qʰʷeɡ (許役切 狊聲 錫)	
瞁	qʰʷeːɡ (呼狊切 狊聲 錫)	
瞂	bod (房越切 犮聲 月3)	
瞉	kʰoːɡs (苦候切 殻聲 候)	目原在正下
瞋	tʰjin (昌眞切 眞聲 眞1)	
瞌	kʰaːb (克盍切 盍聲 盍1)	
瞍	sɯːw (蘇彫切 叟聲 幽1)	
瞍	suːʔ (蘇后切 叟聲 幽1)	
瞎	qʰraːd (許鎋切 害聲 月1)	見釋名
瞐	mroːɡ (莫角切 目聲 屋)	
瞑	meːn (莫賢切 冥聲 元2)	
瞑	meːns (莫甸切 冥聲 元2)	見尚書
瞑	meːŋ (莫經切 冥聲 耕)	
瞖	qiːs (於計切 医聲 脂2)	素問翳分化字
瞗	tɯːw (都聊切 鳥聲 幽2)	
瞘	qoː (烏侯切 區聲 侯)	
瞙	maːɡ (慕各切 莫聲 鐸)	
瞚	hljuns (舒閏切 寅聲 文2)	後作瞬同
瞜	roː (落侯切 婁聲 侯)	
瞜	ro (力朱切 婁聲 侯)	
瞞	moːn (母官切 芇聲 元3)	朱駿聲芇聲
瞟	pʰew (撫招切 票聲 宵2)	
瞟	pʰewʔ (敷沼切 票聲 宵2)	
瞠	rtʰaːŋ (丑庚切 尚聲 陽)	
瞡	kʷels (規恚切 規聲 歌3)	見荀子
瞡	kʷils (居悸切 規聲 脂1)	見荀子
瞢	mɯːŋ (武登切 夢聲 蒸)	
瞢	mɯŋ (莫中切 夢聲 蒸)	
瞢	mɯŋs (莫鳯切 夢聲 蒸)	
瞤	njun (如勻切 閏聲 文2)	
瞥	pʰed (芳滅切 敝聲 月2)	
瞥	pʰeːd (普蔑切 敝聲 月2)	
瞦	qʰlɯ (許其切 喜聲 之)	
瞪	dɯŋ (直陵切 登聲 蒸)	見漢賦
瞪	dɯŋs (丈證切 登聲 蒸)	
瞪	rdɯːŋ (宅耕切 登聲 蒸)	見漢賦
瞫	l'ɯːms (徒紺切 覃聲 侵1)	
瞫	hljɯmʔ (式荏切 覃聲 侵1)	
瞬	hljuns (舒閏切 舛聲 文2)	
瞭	reːw (落蕭切 尞聲 宵2)	
瞭	reːwʔ (盧鳥切 尞聲 宵2)	
瞯	ɡreːn (戸閒切 閒聲 元2)	
瞰	kʰlaːms (苦濫切 敢聲 談1)	見楚辭
瞱	ɢʷrab (筠輒切 曄聲 盍1)	
瞲	qʰʷilʔ (火癸切 矞聲 脂1)	原右作商或啇，依余校正，集韻從巂
瞲	qʰʷids (香季切 矞聲 至1)	原右從啇，余依王二校正，集韻從巂
瞲	qʰʷiːd (呼決切 矞聲 質1)	
瞳	doːŋ (徒紅切 重聲 東)	
瞴	ma (武夫切 無聲 魚)	
瞴	maʔ (文甫切 無聲 魚)	
瞵	rin (力珍切 粦聲 眞1)	
瞵	rins (良刃切 粦聲 眞1)	
瞶	luls (以醉切 貴聲 微3)	
瞶	kluls (居胃切 貴聲 微2)	
瞹	qaːds (於蓋切 愛聲 祭1)	校本改曖，集韻無
瞺	qoːbs (烏外切 會聲 蓋3)	
瞻	tjam (職廉切 詹聲 談1)	
瞼	kramʔ (居奄切 僉聲 談1)	
瞽	kʷaːʔ (公戸切 鼓聲 魚)	
瞿	kʷas (九遇切 瞿聲 魚)	䀠分化字
瞿	ɡʷa (其俱切 瞿聲 魚)	見書
矀	mrɯl (武悲切 微聲 微1)	集韻同覹
矀	mɯl (無非切 微聲 微1)	說文從見
矆	qʰʷaɡ (許縛切 蒦聲 鐸)	
矇	moːŋ (莫紅切 冡聲 東)	
矉	pin (必鄰切 賓聲 眞1)	
矊	men (武延切 綿聲 元2)	見方言
矌	kʰʷaːŋs (苦謗切 黄聲 陽)	
矍	kʷaɡ (居縛切 矍聲 鐸)	
矎	qʰʷeːn (火玄切 夐聲 元2)	見漢賦
矎	qʰʷeŋs (休正切 夐聲 耕)	見漢賦
矏	men (武延切 臱聲 元2)	
矏	meːn (莫賢切 臱聲 元2)	
矐	qʰʷaːɡ (虚郭切 霍聲 鐸)	
矐	qʰaːɡ (呵各切 霍聲 鐸)	見史記
矑	b·raː (落胡切 虍聲 魚)	見揚雄賦方言
矔	koːns (古玩切 雚聲 元3)	
矔	kroːns (古患切 雚聲 元3)	
矕	mroːnʔ (武板切 龻聲 元3)	
矖	rel (呂支切 丽聲 歌2)	
矖	srelʔ (所綺切 丽聲 歌2)	
矗	hr'uɡ (丑六切 矗聲 覺1)	見上林賦
矗	shruɡ (初六切 矗聲 覺1)	
矘	tʰaːŋʔ (他朗切 尚聲 陽)	
矚	tjoɡ (之欲切 蜀聲 屋)	
矛	mu (莫浮切 矛聲 幽1)	
矜	ɡrɯn (巨巾切 今聲 文1)	𥎊下注古體
矜	ɡɯn (巨斤切 今聲 文1)	𥎊下注古體
矜	kɯŋ (居陵切 今聲 蒸)	
矞	ɢʷid (餘律切 矞聲 質1)	
矟	sreːwɢ (所角切 肖聲 藥2)	見釋名或作槊
矠	shreːɡ (楚革切 昔聲 錫)	
矠	zreːɡ (士革切 昔聲 錫)	
矢	hliʔ (式視切 矢聲 脂2)	
矣	ɢlɯʔ/ɢɯʔ (于紀切 矣聲 之)	說文以聲，金文從丩矢或爲矢聲
矤	hlinʔ (式忍切 矤聲 眞1)	
知	ʔl'e (陟離切 矢聲 支)	沈兼士依韻會所引說文從口矢聲
矦	ɡoː (戶鉤切 侯聲 侯)	同侯，説文本字
矧	hlinʔ (式忍切 引聲 眞1)	同矤
矨	ŋeːŋʔ (五剄切 矨聲 耕)	
矩	kʷaʔ (俱雨切 巨聲 魚)	
矪	tɯw (張流切 舟聲 幽2)	
矬	zoːl (昨禾切 坐聲 歌3)	
短	toːnʔ (都管切 豆聲 元3)	
矮	qraːlʔ (烏蟹切 委聲 歌1)	
矯	krewʔ (居夭切 喬聲 宵2)	
矰	ʔsɯːŋ (作縢切 曾聲 蒸)	
矲	breːlʔ (薄蟹切 罷聲 歌2)	
石	djaɡ (常隻切 石聲 鐸)	
矴	teːŋs (丁定切 丁聲 耕)	
矸	kaːnʔ (古旱切 干聲 元1)	
矸	kaːns (古案切 干聲 元1)	見應劭文
矸	ɡaːns (侯旰切 干聲 元1)	
矹	ŋluːd (五忽切 兀聲 物2)	
矺	ʔr'aːɡs (陟駕切 乇聲 暮)	都榼切注又切
矺	ʔl'aːb (都榼切 乇聲 盍1)	
矺	ʔl'aːɡ (當各切 乇聲 鐸)	
矺	l̥ʰaːɡ (他各切 乇聲 鐸)	見儀禮鄭注
矺	ʔr'eːɡ (陟革切 乇聲 錫)	
矻	kʰuːd (苦骨切 乞聲 物2)	
矼	kroːŋ (古雙切 工聲 東)	
砂	sraːl (所加切 沙聲 歌1)	俗沙字
砅	pʰrɯŋ (披冰切 仌聲 蒸)	余校爲砯
砅	rads (力制切 砅聲 祭1)	說文或作濿，詩作厲
砉	qʰʷraːɡ (虎伯切 砉聲 鐸)	
砉	qʰʷeːɡ (呼狊切 砉聲 錫)	
砊	kʰaːŋs (苦浪切 亢聲 陽)	
砊	kʰraːŋ (客庚切 亢聲 陽)	
砌	shiːds (七計切 七聲 至1)	見班固賦
砍	kʰoːmʔ (苦感切 欠聲 談3)	扻後起字，亦作坎，金代後作砍
砎	kreːds (古拜切 介聲 祭2)	
砎	kreːd (古黠切 介聲 月2)	
砎	ɡraːd (胡瞎切 介聲 月1)	
砏	prɯn (府巾切 分聲 文1)	
砏	pʰrɯn (普巾切 分聲 文1)	原誤列諄韻
砏	pʰɯn (撫文切 分聲 文1)	撫由府校改
砐	ŋɡɯːb (五合切 及聲 緝1)	
砑	ŋraːs (吾駕切 牙聲 魚)	
砒	pʰiː (匹迷切 比聲 脂2)	廣韻作磇集韻此爲正
研	ŋɡeːn (五堅切 幵聲 元2)	
研	ŋeːns (吾甸切 幵聲 元2)	
砝	kaːb (居盍切 去聲 盍1)	
砝	kab (居怯切 去聲 盍1)	
砟	zaːɡ (在各切 乍聲 鐸)	見曹操氣出唱
砠	sha (七余切 且聲 魚)	同岨
砡	ŋuɡ (魚菊切 玉聲 覺1)	見漢賦
砢	ɡ·raːlʔ (來可切 可聲 歌1)	
砥	tjelʔ (諸氏切 氐聲 歌2)	
砥	tjil (旨夷切 氐聲 脂1)	
砥	tjilʔ (職雉切 氐聲 脂1)	
砥	tjils (脂利切 氐聲 脂1)	
砦	zraːds (豺夬切 此聲 祭1)	見三國志，莊子作柴
砧	ʔl'ɯm (知林切 占聲 侵2)	同碪見漢賦
砩	pads (方肺切 弗聲 祭1)	肺由胏校改
砬	rɯb (力入切 立聲 緝1)	
砭	prom (府廉切 乏聲 談3)	
砭	proms (方驗切 乏聲 談3)	
砮	naː (乃都切 女聲 魚)	
砮	naːʔ (奴古切 女聲 魚)	
砰	pʰreːŋ (普耕切 平聲 耕)	見史記
砱	reːŋ (郎丁切 令聲 耕)	
破	pʰaːls (普過切 皮聲 歌1)	
砸	zaːd (才割切 帀聲 月1)	手冊作㩵今字
硂	shlon (此緣切 全聲 元3)	同銓
硃	tjo (章俱切 朱聲 侯)	朱分化字
硅	qʰʷreɡ (虎伯切 圭聲 錫)	疑即砉之別體
硇	rnuː (尼交切 匘聲 幽1)	堖省聲
硈	kʰriːd (恪八切 吉聲 質1)	
硉	ruːd (勒沒切 聿聲 物2)	
硊	ŋrolʔ (魚毀切 危聲 歌3)	見楚辭招隱士
硋	ŋɡɯːɡs (五溉切 亥聲 志)	同礙
硌	ɡ·raːɡ (盧各切 各聲 鐸)	見山海經
硍	ɡrɯːnʔ (胡簡切 艮聲 文1)	
硎	kʰreːŋ (客庚切 井聲 耕)	同阬坑，集韻別義
硎	ɡeːŋ (戸經切 井聲 耕)	見莊子
硐	doːŋ (徒紅切 同聲 東)	見通俗文
硐	doːŋʔ (徒揔切 同聲 東)	
硜	kʰreːŋ (口莖切 坙聲 耕)	見論語
硝	sew (相邀切 肖聲 宵2)	
硞	kʰruːɡ (苦角切 告聲 覺1)	
硞	kʰuːɡ (苦沃切 告聲 覺1)	
硟	slan (相然切 延聲 元1)	
硟	l̥ʰjans (昌戰切 延聲 元1)	
硠	raːŋ (魯當切 良聲 陽)	
硤	ɡreːb (侯夾切 夾聲 盍2)	
硦	rʷaːɡ (盧穫切 弄聲 鐸)	連綿詞石郭硦順同化音變
硨	kʰlja (尺遮切 車聲 魚)	
硩	l̥ʰed (丑列切 折聲 月2)	
硩	l̥ʰeːɡ (他歷切 折聲 錫)	
硪	ŋaːl (五何切 我聲 歌1)	
硪	ŋaːlʔ (五可切 我聲 歌1)	
硫	ru (力求切 流聲 幽1)	
硬	ŋɡraːŋs (魚孟切 丙聲 陽)	見傷寒論
硬	ŋɡraːŋs (五爭切 丙聲 陽)	同鞕，王韻五孟反
硭	maŋ (武方切 亡聲 陽)	
确	ɡroːɡ (胡覺切 角聲 屋)	
硯	ŋɡeːn (五堅切 見聲 元2)	
硯	ŋɡeːns (吾甸切 見聲 元2)	
硰	ʔsaːlʔ (作可切 沙聲 歌1)	原列果韻末，依切語爲開口
硰	shaːlʔ (千可切 沙聲 歌1)	見史記
硰	sraːl (所加切 沙聲 歌1)	見漢書
硱	kʰɯŋ (綺兢切 困聲 蒸)	
硱	kʰuːnʔ (苦本切 困聲 文2)	
硹	sqʰluŋ (息弓切 公聲 終)	
硻	kʰreːŋ (口莖切 臣聲 耕)	
硾	dols (馳僞切 垂聲 歌3)	見呂氏春秋
硿	kʰoːŋ (苦紅切 工聲 東)	
碁	ɡɯ (渠之切 其聲 之)	同棊見戰國策
碆	paːl (博禾切 皮聲 歌1)	說文作磻
碆	baːl (薄波切 皮聲 歌1)	
碌	roːɡ (盧谷切 录聲 屋)	見史記
碌	roɡ (力玉切 录聲 屋)	
碎	suːds (蘇內切 卒聲 隊2)	
碏	shaɡ (七雀切 昔聲 鐸)	
碑	pre (彼爲切 卑聲 支)	
碓	tuːls (都隊切 隹聲 微2)	
碔	maʔ (文甫切 武聲 魚)	同珷見子虛賦
碕	kʰral (去奇切 奇聲 歌1)	
碕	kʰralʔ (墟彼切 奇聲 歌1)	
碕	ɡral (渠羈切 奇聲 歌1)	
碕	ɡɯl (渠希切 奇聲 微1)	
碖	ruːnʔ (盧本切 侖聲 文2)	
碖	ruːns (盧困切 侖聲 文2)	
碗	qoːnʔ (烏管切 夗聲 元3)	盌椀晚起字
碝	njonʔ (而兖切 耎聲 元3)	
碞	ŋrɯːm (五咸切 碞聲 侵1)	
碞	ŋrɯm (魚金切 碞聲 侵1)	
碟	l'eːb (徒協切 世聲 盍2)	曡後起分化字
碡	doːɡ (徒谷切 毒聲 屋)	
碡	duːɡ (徒沃切 毒聲 覺1)	
碡	duɡ (直六切 毒聲 覺1)	
碢	l'oːl (徒和切 冎聲 歌3)	玉篇同砣
碣	ɡrad (渠列切 曷聲 月1)	
碣	ɡad (其謁切 曷聲 月1)	
碥	peːnʔ (方典切 扁聲 元2)	
碧	praɡ (彼役切 白聲 鐸)	
碧	preɡ (彼役切 白聲 鐸)	
碨	quːlʔ (烏賄切 畏聲 微2)	
碨	qruːl (乙乖切 畏聲 微2)	乖由皆校改
碩	djaɡ (常隻切 石聲 鐸)	
碪	ʔl'um (知林切 甚聲 侵3)	椹分化字或作砧
碫	toːns (丁貫切 段聲 元3)	
碬	ɡraː (胡加切 叚聲 魚)	
碭	l'aːŋ (徒郎切 昜聲 陽)	
碭	l'aːŋs (徒浪切 昜聲 陽)	
碯	nuːʔ (奴晧切 匘聲 幽1)	
確	kʰroːwɢ (苦角切 寉聲 藥3)	
碻	kʰraːwɢ (苦角切 高聲 藥1)	同確
碼	mraːʔ (莫下切 馬聲 魚)	古作馬
碽	koːŋ (古紅切 工聲 東)	
碾	ndenʔ (尼展切 展聲 元2)	輾分化字
碾	ndens (女箭切 展聲 元2)	輾轉註見通俗文
磁	zɯ (牆之切 兹聲 之)	同礠見山海經
磃	sle (息移切 虒聲 支)	
磄	l'aːŋ (徒郎切 庚聲 陽)	磅磄古作旁唐
磅	pʰaːŋ (普郎切 方聲 陽)	見上林賦
磅	pʰraːŋ (撫庚切 方聲 陽)	見上林賦
磆	ɡruːd (戸八切 骨聲 物2)	滑石之滑類化
磇	pʰiː (匹迷切 比聲 脂2)	
磈	kʰuːlʔ (口猥切 鬼聲 微2)	
磈	qulʔ (於鬼切 鬼聲 微2)	見楚辭
磉	sŋaːŋʔ (蘇朗切 桑聲 陽)	
磊	ruːlʔ (落猥切 磊聲 微2)	同磥
磋	shlaːl (七何切 左聲 歌1)	
磌	diːn (徒年切 眞聲 眞1)	見班固賦
磌	tjin (職鄰切 眞聲 眞1)	側鄰切校改見班固賦
磍	kreːd (古黠切 害聲 月2)	見漢書
磍	kʰraːd (枯鎋切 害聲 月1)	
磎	kʰeː (苦奚切 奚聲 支)	同谿見漢賦
磐	baːn (薄官切 般聲 元1)	
磑	ŋɯːl (魚開切 豈聲 微1)	見宋玉賦
磑	ŋuːl (五灰切 豈聲 微2)	
磑	ŋuːls (五對切 豈聲 微2)	
磒	ɢunʔ (于敏切 員聲 文2)	
磓	tuːl (都回切 追聲 微2)	
磔	rtaːɡ (陟格切 石聲 鐸)	
磕	kʰaːb (苦盍切 盍聲 盍1)	
磕	kʰaːd (苦曷切 盍聲 月1)	
磖	ruːb (盧合切 習聲 緝3)	
磚	tjon (職緣切 專聲 元3)	塼後起或體
磝	ŋraːw (五交切 敖聲 宵1)	
磟	ruːwɢ (盧谷切 翏聲 屋)	
磟	rɯwɢ (力竹切 翏聲 覺2)	
磡	kʰuːms (苦紺切 甚聲 侵3)	嵁分化字
磢	shraŋʔ (初兩切 爽聲 陽)	
磣	shrumʔ (初朕切 參聲 侵3)	
磤	qɯnʔ (於謹切 殷聲 文1)	
磥	ruːlʔ (落猥切 畾聲 微2)	見宋玉賦
磧	sheɡ (七迹切 朿聲 錫)	
磨	maːl (莫婆切 麻聲 歌1)	
磨	maːls (模臥切 麻聲 歌1)	
磩	shlɯːwɢ (倉歷切 尗聲 覺2)	見班固賦
磫	ʔsloŋ (即容切 从聲 東)	
磬	kʰeːŋs (苦定切 殸聲 耕)	
磭	ŋrɯnʔ (宜引切 辰聲 文1)	疑爲語偃切屵字錯讀（屵磭聯綿）
磭	ŋ̥ʰjaɡ (昌約切 石聲 鐸)	
磭	ŋaɡ (魚約切 石聲 鐸)	
磯	kɯl (居依切 幾聲 微1)	見孟子
磰	djenʔ (常演切 善聲 元2)	同墡
磲	ɡa (强魚切 巨聲 魚)	
磳	ʔsɯːŋ (作縢切 曾聲 蒸)	見劉安招隱士
磳	zɯŋ (仕兢切 曾聲 蒸)	見劉安招隱士
磴	tɯːŋ (都騰切 登聲 蒸)	
磴	tɯːŋs (都鄧切 登聲 蒸)	
磴	tʰɯːŋ (他登切 登聲 蒸)	
磶	sjaːɡ (思積切 舄聲 鐸)	見張衡賦
磷	rin (力珍切 粦聲 眞1)	同粼見史記
磷	rins (良刃切 粦聲 眞1)	見論語
磹	l'ɯːms (徒念切 覃聲 侵1)	
磻	baːn (薄官切 番聲 元1)	
磼	zuːb (徂合切 集聲 緝3)	見史記
磽	ŋ̥ʰreːw (口交切 垚聲 宵2)	
磽	ŋreːws (五敎切 垚聲 宵2)	
磽	ŋ̥ʰeːwʔ (苦皎切 垚聲 宵2)	
磾	teːl (都奚切 單聲 歌2)	漢有金日磾
磿	reːɡ (郎擊切 秝聲 錫)	
礉	kʰreːw (口交切 敫聲 宵2)	同䂭
礉	kʰreːwɢs (苦敎切 敫聲 豹2)	
礊	kʰreːɡ (苦格切 毄聲 鐸)	
礊	kʰreːɡ (楷革切 毄聲 錫)	
礊	qʰʷreːɡ (呼麥切 毄聲 錫)	
礌	ruːl (盧回切 畾聲 微2)	礧後起字
礌	ruːls (盧對切 畾聲 微2)	同礧，今通行
礎	sŋ̥ʰraʔ (創舉切 疋聲 魚)	
礏	ŋoːb (五合切 業聲 盍3)	見史記
礐	kʰruːɡ (苦角切 學聲 覺1)	
礐	ɡ·rɯːɡ (力摘切 學聲 職)	
礐	ɡoːɡ (胡谷切 學聲 屋)	
礐	ɡuːɡ (胡沃切 學聲 覺1)	
礒	ŋralʔ (魚倚切 我聲 歌1)	見楚辭招隱士
礓	kaŋ (居良切 畺聲 陽)	
礘	ŋɯːb (五合切 濕聲 緝1)	
礙	ŋɯːs (五溉切 疑聲 之)	
礛	kraːm (古銜切 監聲 談1)	見淮南子
礜	las (羊洳切 舁聲 魚)	
礠	zlɯ (疾之切 兹聲 之)	
礡	baːɡ (傍各切 甫聲 鐸)	右原爲薄
礣	mreːd (莫八切 蔑聲 月2)	
礤	shlaːd (七曷切 祭聲 月1)	集韻同攃
礥	ɡiːn (胡田切 臣聲 眞1)	見太玄
礥	ɢrin (下珍切 臣聲 眞1)	見太玄
礦	kʷraːŋʔ (古猛切 黄聲 陽)	說文作磺
礧	ruːll (盧回切 畾聲 微2)	
礧	ruːlʔ (落猥切 畾聲 微2)	
礧	ruːls (盧對切 畾聲 微2)	見漢書
