#漢字	音標	解釋
抵	tiːlʔ (都禮切 氐聲 脂1)	
抶	l̥ʰiɡ (丑栗切 失聲 質2)	
抹	maːd (莫撥切 末聲 月1)	說文作瀎
抻	hlins (試刃切 申聲 眞1)	
押	kraːb (古狎切 甲聲 盍1)	
押	qraːb (烏甲切 甲聲 盍1)	
抽	l̥ʰɯw (丑鳩切 由聲 幽2)	說文正體從留聲又由聲秀聲
抾	kʰɯ (丘之切 去聲 之)	去其切之又切
抾	kʰɯ (去其切 去聲 之)	見揚雄賦
抾	kʰab (去劫切 去聲 盍1)	見揚雄賦
抿	mrɯn (眉貧切 昏聲 文)	同捪
抿	mrɯn (眉貧切 民聲 文1)	同捪見呂氏春秋
抿	mrɯnʔ (美殞切 民聲 文1)	捪今字
拂	pʰɯd (敷勿切 弗聲 物1)	
拃	ʔsraːnʔ (側板切 乍聲 元1)	
拄	toʔ (知庾切 主聲 侯)	
担	taːnʔ (多旱切 旦聲 元1)	今作撣。玉篇字林“拂也”
拆	tŋ̥ʰraːɡ/ŋ̥ʰr'aːɡ (恥格切 屰聲 鐸)	同坼
拇	mɯʔ (莫厚切 母聲 之)	
拈	neːm (奴兼切 占聲 談2)	
拉	ruːb (盧合切 立聲 緝3)	
拊	pʰoʔ (芳武切 付聲 侯)	
拋	pʰreːw (匹交切 拋聲 宵2)	當爲尥省聲
拋	pʰreːws (匹皃切 拋聲 宵2)	
拌	pʰaːn (普官切 半聲 元1)	
拌	baːnʔ (蒲旱切 半聲 元1)	
拍	pʰraːɡ (普伯切 白聲 鐸)	
拎	reːŋ (郎丁切 令聲 耕)	
拏	rnaː (女加切 女聲 魚)	今作拿
拐	ɡʷroːlʔ (求蟹切 枴聲 歌3)	余校爲柺
拑	ɡram (巨淹切 甘聲 談1)	
拒	ɡaʔ (其呂切 巨聲 魚)	
拓	tʰaːɡ (他各切 石聲 鐸)	見小爾雅
拓	tjaɡ (之石切 石聲 鐸)	同摭
拔	bruːd (蒲八切 犮聲 月2)	
拔	boːd (蒲撥切 犮聲 月3)	
拔	bod (房越切 犮聲 月3)	
拕	l̥ʰaːl (託何切 它聲 歌1)	
拕	l'aːlʔ (徒可切 它聲 歌1)	
拖	l̥ʰaːl (託何切 也聲 歌1)	
拖	l̥ʰaːls (吐邏切 也聲 歌1)	俗拕字
拗	qrɯːwʔ (於絞切 幼聲 幽2)	
拗	qrɯːws (於敎切 幼聲 幽2)	原從人，晚轉註從手見韻會
拘	ko (舉朱切 句聲 侯)	
拙	kljod (職悅切 出聲 月3)	
拚	pʰaːn (普官切 半聲 元3)	拌俗字，右原從棄
拚	brons (皮變切 弁聲 元3)	
拚	puns (方問切 弁聲 文1)	原作上弁下土字之或體
招	tjew (止遙切 刀聲 宵2)	
拜	proːds (博怪切 拜聲 祭3)	
拫	ɡɯːn (戸恩切 艮聲 文1)	
括	koːd (古活切 桰聲 月3)	從氏下口聲同有塞義
拭	hljɯɡ (賞職切 弋聲 職)	
拮	kiːd (古屑切 吉聲 質1)	
拮	klid (居質切 吉聲 質1)	
拯	kljɯŋʔ (支庱切 丞聲 蒸)	原音蒸上聲無切語，此切爲五音集韻補
拰	nɯmʔ (尼凜切 壬聲 侵1)	
拱	kloŋʔ (居悚切 共聲 東)	
拲	kloŋʔ (居悚切 共聲 東)	
拲	kloɡ (居玉切 共聲 屋)	
拳	ɡron (巨員切 龹聲 元3)	
拴	sroːn (數還切 全聲 元3)	𣟴（閂）栓後起字，冒栓作動詞
拴	shlon (此緣切 全聲 元3)	俗字表揀選集韻通銓
拵	zluːn (徂尊切 存聲 文1)	
拶	ʔslaːd (姊末切 拶聲 月1)	原列末韻右爲列省聲
拷	kʰluːʔ (苦浩切 丂聲 幽1)	
拸	lal (弋支切 多聲 歌1)	見莊子亦作移
拸	lalʔ (移爾切 多聲 歌1)	扡注或體，齊韻成臡切注又余氏切
拹	hlab (虚業切 劦聲 盍1)	
拺	shreːɡ (楚革切 朿聲 錫)	
拺	sreːɡ (山责切 朿聲 錫)	
拼	preːŋ (北萌切 并聲 耕)	
拽	led (羊列切 曳聲 月2)	抴注或體
拾	ɡjub (是執切 合聲 緝3)	
拿	rnaː (女加切 女聲 魚)	拏晚起字
持	l'ɯ (直之切 寺聲 之)	
挂	kʷreːs (古賣切 圭聲 支)	
挃	tiɡ (陟栗切 至聲 質2)	
挆	toːlʔ (丁果切 朵聲 歌3)	說文作女旁
挆	toːls (都唾切 朵聲 歌3)	集韻同女旁朶
指	kjiʔ (職雉切 旨聲 脂2)	
挈	kʰeːd (苦結切 丯聲 月2)	
按	qaːns (烏旰切 安聲 元1)	
挋	kiŋs (章刃切 臣聲 眞2)	
挌	ɡ·raːɡ (盧各切 各聲 鐸)	
挌	kraːɡ (古伯切 各聲 鐸)	
挎	kʰʷaː (苦胡切 于聲 魚)	見儀禮
挏	doːŋ (徒紅切 同聲 東)	
挏	doːŋʔ (徒揔切 同聲 東)	
挐	rnaː (女加切 女聲 魚)	
挐	na (女余切 女聲 魚)	
挑	l̥ʰaːw (土刀切 兆聲 宵1)	
挑	l̥ʰeːw (吐彫切 兆聲 宵2)	
挑	l'eːwʔ (徒了切 兆聲 宵2)	
挒	red (良薛切 列聲 月2)	
挖	qʷriːd (烏八切 乙聲 質1)	穵晚起分化字
挨	qlɯːʔ (於改切 矣聲 之)	
挨	qrɯː (英皆切 矣聲 之)	廣韻乙諧切右從俟
挨	qrɯːʔ (於駭切 矣聲 之)	
挩	l̥ʰoːd (他括切 兌聲 月3)	
挩	l'oːd (徒活切 兌聲 月3)	
挪	naːl (諾何切 冉聲 歌1)	
挫	ʔsoːls (則臥切 坐聲 歌3)	
挬	bɯːd (蒲沒切 孛聲 物1)	見淮南子
挭	kraːŋʔ (古杏切 丙聲 陽)	
挮	tʰiːlʔ (他禮切 弟聲 脂1)	
振	tjɯn (側鄰切 辰聲 文1)	原誤側鄰切，依韻目注改
振	tjɯns (章刃切 辰聲 文1)	
挰	rleːŋ (直庚切 呈聲 陽)	耕
挱	saːl (素何切 沙聲 歌1)	禮鄭注作莎，釋名作娑
挱	sraːl (師加切 沙聲 歌1)	
挲	saːl (素何切 沙聲 歌1)	同挱
挴	mlɯːʔ (莫亥切 母聲 之)	見方言
挴	mɯːʔ (武罪切 母聲 之)	原右上作土，據校改。見方言
挶	koɡ (居玉切 局聲 屋)	
挸	keːnʔ (古典切 見聲 元2)	
挹	qɯb (伊入切 邑聲 緝1)	
挺	l'eːŋ (特丁切 廷聲 耕)	
挺	l'eːŋʔ (徒鼎切 廷聲 耕)	
挻	hljan (式連切 延聲 元1)	
挼	noːl (奴禾切 妥聲 歌3)	捼注俗體見漢賦
挼	snuːl (素回切 妥聲 微2)	
挽	monʔ (無遠切 免聲 元3)	
挾	skaːb (作答切 夾聲 盍1)	集韻誤列合韻又讀帖韻是
挾	ɡeːb (胡頰切 夾聲 盍2)	
捀	boŋ (符容切 丰聲 東)	
捀	boŋs (扶用切 丰聲 東)	
捂	ŋaːs (五故切 五聲 魚)	見儀禮
捃	kluns (居運切 君聲 文2)	同攈見說苑
捄	ɡu (巨鳩切 求聲 幽1)	
捄	ko (舉朱切 求聲 侯)	
捅	l̥ʰoːŋʔ (他孔切 用聲 東)	見孫臏兵法簡
捆	kʰuːnʔ (苦本切 困聲 文2)	見孟子
捇	qʰʷreːɡ (呼麥切 赤聲 錫)	
捈	l̥ʰaː (他胡切 余聲 魚)	
捈	l'aː (同都切 余聲 魚)	
捉	ʔsoːɡ (側角切 足聲 屋)	
捊	bruː (薄交切 孚聲 幽1)	
捊	buw (薄侯切 孚聲 侯)	
捋	roːd (郎括切 寽聲 月3)	
捌	preːd (博拔切 别聲 月2)	
捌	praːd (百鎋切 别聲 月1)	
捍	ɡaːns (侯旰切 干聲 元1)	
捍	ɡraːnʔ (下赧切 干聲 元1)	
捎	sreːw (所交切 肖聲 宵2)	
捎	sew (相邀切 肖聲 宵2)	
捏	niːɡ (奴結切 日聲 質2)	涅省聲
捐	ɢʷen (與專切 肙聲 元2)	
捒	sreːɡ (山責切 朿聲 錫)	
捒	sroɡs (所去切 束聲 竇)	
捒	sroɡs (色句切 束聲 竇)	
捔	sɡroːɡ (士角切 角聲 屋)	見漢賦
捔	kroːɡ (古岳切 角聲 屋)	見淮南子
捕	baːs (薄故切 甫聲 魚)	
捖	ɦŋoːn (胡官切 元聲 元3)	
捘	ʔsluːls (子對切 允聲 微2)	
捘	ʔsluːns (子寸切 允聲 文2)	
捘	shlun (七倫切 允聲 文2)	
捠	praːŋ (布耕切 兵聲 陽)	集韻作土旁改入庚韻
捥	qoːns (烏貫切 夗聲 元3)	同腕
捦	ɡrɯm (巨金切 金聲 侵1)	同手旁禁
捧	pʰoŋʔ (敷奉切 丰聲 東)	見莊子
捨	hljaːʔ (書冶切 余聲 魚)	
捩	rɯːds (郎計切 戾聲 隊1)	
捩	rɯːd (練結切 戾聲 物1)	
捪	mrɯnʔ (美殞切 昏聲 文1)	原列準韻右從昬今作抿
捫	mɯːn (莫奔切 門聲 文1)	
捭	preːʔ (北買切 卑聲 支)	
据	ka (九魚切 古聲 魚)	
捱	ŋreː (宜佳切 圭聲 支)	
捲	kronʔ (居轉切 卷聲 元3)	
捲	krons (居倦切 卷聲 元3)	
捲	ɡron (巨員切 卷聲 元3)	
捳	ŋroːɡ (五角切 岳聲 屋1)	
捶	tjolʔ (之累切 垂聲 歌3)	
捷	zeb (疾葉切 疌聲 盍2)	
捺	naːd (奴曷切 奈聲 月1)	
捻	nɯːb (奴協切 念聲 緝1)	
捼	noːl (奴禾切 委聲 歌3)	
捼	nuːl (乃回切 委聲 微2)	疑本妥聲
捼	njul (儒隹切 委聲 微3)	疑本妥聲
捽	zuːd (昨沒切 卒聲 物2)	
捽	zud (慈卹切 卒聲 物2)	
捾	qoːd (烏括切 官聲 月3)	
掀	qʰan (虚言切 斤聲 元1)	
掁	rdaːŋ (直庚切 長聲 陽)	
掂	tiːm (丁兼切 占聲 侵2)	敁晚起分化字
掃	suːʔ (蘇老切 掃聲 幽1)	同埽
掃	suːs (蘇到切 掃聲 幽1)	同埽
掄	ruːn (盧昆切 侖聲 文2)	見爾雅
掄	run (力迍切 侖聲 文2)	
掅	shleːŋs (千定切 生聲 耕)	
掆	klaːŋ (古郎切 岡聲 陽)	古作扛
掆	klaːŋs (古浪切 岡聲 陽)	
掇	toːd (丁括切 叕聲 月3)	
掇	tod (陟劣切 叕聲 月3)	
授	djus (承呪切 受聲 幽1)	
掉	deːwʔ (徒了切 卓聲 宵2)	
掉	deːwɢs (徒弔切 卓聲 豹2)	見左傳
掉	rneːwɢ (女角切 卓聲 藥2)	
掊	bruː (薄交切 咅聲 幽1)	
掊	poːʔ/puʔ (方垢切 咅聲 侯)	
掊	bɯ (薄侯切 咅聲 之)	
掊	bɯ (縛謀切 咅聲 之)	
掌	tjaŋʔ (諸兩切 尚聲 陽)	
掍	ɡuːnʔ (胡本切 昆聲 文2)	
掎	kral (居宜切 奇聲 歌1)	
掎	kralʔ (居綺切 奇聲 歌1)	
掎	kʰrals (卿義切 奇聲 歌1)	
掏	l̥ʰuː (土刀切 匋聲 幽1)	同搯見通俗文
掏	l'uː (徒刀切 匋聲 幽1)	
掐	kʰroːb (苦洽切 臽聲 盍3)	
排	brɯːl (步皆切 非聲 微1)	
掓	hljɯwɢ (式竹切 尗聲 覺2)	
掔	kʰriːn (苦閑切 臣聲 眞1)	
掔	kʰiːn (苦堅切 臣聲 眞1)	臤轉註字
掕	rɯŋ (力膺切 夌聲 蒸)	
掖	laːɡ (羊益切 亦聲 鐸)	
掘	ɡlod (其月切 出聲 月3)	
掘	ɡlud (衢物切 出聲 物2)	
掛	kʷreːs (古賣切 圭聲 支)	俗同掛
掜	rŋeː (妳佳切 兒聲 支)	
掜	ŋeːʔ (研啓切 兒聲 支)	見漢簡
掝	qʰʷrɯːɡ (呼麥切 或聲 職)	
掞	hljams (舒贍切 炎聲 談1)	
掟	deːŋs (徒徑切 正聲 耕)	
掠	ɡ·raŋs (力讓切 京聲 陽)	
掠	ɡ·raɡ (離灼切 京聲 鐸)	
採	shɯːʔ (倉宰切 采聲 之)	俗採字見史記
探	l̥ʰuːm (他含切 罙聲 侵3)	
探	l̥ʰuːms (他紺切 罙聲 侵3)	
掣	kʰjeds (尺制切 制聲 祭2)	
掣	kʰjed (昌列切 制聲 月2)	
掤	pɯŋ (筆陵切 朋聲 蒸)	
接	ʔseb (即葉切 妾聲 盍2)	
控	kʰroːŋ (苦江切 工聲 東)	
控	kʰoːŋs (苦貢切 工聲 東)	
推	tʰuːl (他回切 隹聲 微2)	
推	tʰjul (尺隹切 隹聲 微2)	由叉隹切校正
掩	qromʔ (衣儉切 奄聲 談3)	
措	shaːɡs (倉故切 昔聲 暮)	
掫	ʔsloː (子侯切 取聲 侯)	
掫	ʔsruʔ (側九切 取聲 幽1)	
掫	ʔslo (子于切 取聲 侯)	
掬	kluɡ (居六切 匊聲 覺1)	
掮	ɡren* (渠焉切 肩聲 元2)	𠢍今字
掰	preːɡ (博厄切 辟聲 錫)	擘今字
掾	lons (以絹切 彖聲 元3)	
揀	kreːnʔ (古限切 柬聲 元2)	柬轉註分化字見吳越春秋
揀	ɡ·reːns (郎甸切 柬聲 元2)	
揂	sklu (即由切 酉聲 幽1)	
揃	ʔslenʔ (即淺切 前聲 元2)	
揄	l'oː (度侯切 俞聲 侯)	
揄	l'oːʔ (徒口切 俞聲 侯)	
揄	lu (以周切 俞聲 幽1)	同抌
揄	lo (羊朱切 俞聲 侯)	
揅	ŋeːn (五堅切 幵聲 元2)	見小徐本說文
揆	ɡʷilʔ (求癸切 癸聲 脂1)	
揇	nuːmʔ (奴感切 南聲 侵2)	
揈	qʰʷreːŋ (呼宏切 勻聲 耕)	
揉	mju (耳由切 矛聲 幽1)	
揊	pʰrɯɡ (芳逼切 畐聲 職)	
揋	quːl (烏恢切 畏聲 微2)	
揌	snɯː (蘇來切 囟聲 之)	
揎	sqʰʷan (須緣切 亘聲 元1)	
描	mreːw (莫交切 苗聲 宵2)	
描	mrew (武瀌切 苗聲 宵2)	
提	deː (杜奚切 是聲 支)	
提	dje (是支切 是聲 支)	
插	shreːb (楚洽切 臿聲 盍2)	
揔	ʔsloːŋʔ (作孔切 囱聲 東)	同緫
揕	ʔl'ums (知鴆切 甚聲 侵3)	
揖	qib (伊入切 咠聲 緝2)	
揗	ljun (詳遵切 盾聲 文2)	
揗	ɦljunʔ (食尹切 盾聲 文2)	
揗	ɦljuns (食閏切 盾聲 文2)	
揘	ɡʷaŋ (永兵切 王聲 陽)	
揙	pen (卑連切 扁聲 元2)	
揚	laŋ (與章切 昜聲 陽)	金文象人雙手舉玉加昜聲
換	ɢʷaːns (胡玩切 奐聲 元3)	
揜	qaːmʔ (烏敢切 弇聲 談1)	
揜	qramʔ (衣儉切 弇聲 談1)	
揞	qɯːmʔ (烏感切 音聲 侵1)	
揞	qrɯːms (於陷切 音聲 侵1)	
揟	sŋa (相居切 疋聲 魚)	
揠	qreːd (烏黠切 妟聲 月2)	
握	qroːɡ (於角切 屋聲 屋)	
揢	kʰraːɡ (苦格切 各聲 鐸)	
揣	toːlʔ (丁果切 耑聲 歌3)	
揣	shrolʔ (初委切 耑聲 歌3)	
揤	ziɡ (秦悉切 即聲 質2)	
揤	ʔsɯɡ (子力切 即聲 職)	
揥	tʰeds (丑例切 帝聲 祭2)	
揥	teː (都奚切 帝聲 支)	
揧	raːd (盧達切 剌聲 月1)	
揨	rdeːŋ (宅耕切 丁聲 耕)	
揩	kʰriːl (口皆切 皆聲 脂1)	見漢賦
揪	ʔsɯw (即由切 秋聲 幽2)	揫晚起字
揫	ʔsɯw (即由切 秋聲 幽2)	
揬	duːd (陀骨切 突聲 物2)	
揭	kʰrads (去例切 曷聲 祭1)	
揭	ked (居列切 曷聲 月1)	
揭	kʰrad (丘竭切 曷聲 月1)	
揭	ɡrad (渠列切 曷聲 月1)	
揭	kad (居竭切 曷聲 月1)	
揭	ɡad (其謁切 曷聲 月1)	
揮	qʰul (許歸切 軍聲 微2)	
揰	tʰjoŋs (昌用切 重聲 東)	
揱	sreːwɢs (所敎切 肖聲 豹2)	
揱	slew (相邀切 肖聲 宵2)	
揱	sreːwɢ (所角切 肖聲 藥2)	
揲	leb (與涉切 世聲 盍2)	
揲	l'eːb (徒協切 世聲 盍2)	
揲	ɦljed (食列切 世聲 月2)	
揳	sqʰeːd (先結切 丯聲 月2)	另招魂通戛
援	ɢʷans (王眷切 爰聲 元1)	
援	ɢʷan (雨元切 爰聲 元1)	
揵	ɡran (渠焉切 建聲 元1)	見漢賦
揵	kanʔ (居偃切 建聲 元1)	
揾	quːns (烏困切 昷聲 文2)	
揾	qunʔ (於粉切 昷聲 文2)	
揾	quːd (烏沒切 昷聲 物2)	
搄	kɯːŋ (古恒切 亙聲 蒸)	
搄	kɯːŋs (古鄧切 亙聲 蒸)	
搆	koːs (古候切 冓聲 侯)	見國語
搇	kʰrɯms (丘禁切 今聲 侵1)	
搈	loŋ (餘封切 谷聲 東)	
搉	kroːwɢ (古岳切 寉聲 藥3)	
搉	kʰroːwɢ (苦角切 寉聲 藥3)	
搊	ʔsruʔ (側九切 芻聲 幽1)	
搊	shru (楚鳩切 芻聲 幽1)	
搊	ʔsro (莊俱切 芻聲 侯)	
搋	hr'eː (丑皆切 虒聲 支)	見通俗文
搋	hr'eː/shreːl (丑佳切 虒聲 支)	扠字注或體
搌	tenʔ (知演切 展聲 元2)	
搌	tens (陟扇切 展聲 元2)	
搌	tʰenʔ (丑善切 展聲 元2)	
損	sqʰuːnʔ (蘇本切 員聲 文2)	
搎	suːn (思渾切 孫聲 文2)	
搏	paɡs (方遇切 甫聲 暮)	
搏	paːɡ (補各切 甫聲 鐸)	
搏	pʰaːɡ (匹各切 甫聲 鐸)	
搑	njoŋ (而容切 茸聲 東)	
搑	njoŋʔ (而隴切 茸聲 東)	
搒	paːŋs (補曠切 方聲 陽)	
搒	braːŋ (薄庚切 方聲 陽)	
搓	shlaːl (七何切 左聲 歌1)	
搔	suː (蘇遭切 蚤聲 幽1)	
搕	qoːb (烏合切 盍聲 盍3)	
搗	taːwʔ (都晧切 鳥聲 幽1)	俗擣字
搙	rnoːɡ (女角切 辱聲 屋)	
搙	nuːɡ (內沃切 辱聲 覺1)	
搚	raːb (盧合切 劦聲 盍1)	
搚	raːb (盧盍切 劦聲 盍1)	
搛	keːm (堅嫌切 兼聲 談2)	
搜	sru (所鳩切 叟聲 幽1)	
搞	kruːʔ (古巧切 高聲 幽1)	攪今字
搡	sŋaːŋʔ (冩朗切 桑聲 陽)	
搢	ʔsins (即刃切 晉聲 眞1)	
搣	med (亡列切 戌聲 月2)	
搤	qreːɡs (烏懈切 益聲 賜)	
搤	qreːɡ (於革切 益聲 錫)	
搥	tuːl (都回切 追聲 微2)	見法言
搦	rneːwɢ (女角切 弱聲 藥2)	
搦	rnaːwɢ (女白切 弱聲 藥1)	
搨	tʰoːb (託合切 蹋聲 盍3)	手旁沓或體
搨	taːb (都榼切 蹋聲 盍1)	原右上誤罒，榼由搕盍校改
搩	ɡrad (渠列切 桀聲 月1)	
搪	l'aːŋ (徒郎切 庚聲 陽)	見方言
搫	baːl (薄波切 般聲 歌1)	
搫	baːn (薄官切 般聲 元1)	
搬	paːn (北潘切 般聲 元1)	般後起轉註字
搭	tuːb (德合切 合聲 緝3)	
搭	tʰoːb (吐盍切 合聲 盍1)	
搮	riɡ (力質切 栗聲 質2)	
搯	l̥ʰuː (土刀切 舀聲 幽1)	
搰	ɡuːd (戸骨切 骨聲 物2)	
搲	qʷraːs (烏化切 瓜聲 魚)	
搴	kranʔ (九輦切 寒聲 元1)	
搴	kʰran (丘虔切 寒聲 元1)	同攓
搶	shaŋ (七羊切 倉聲 陽)	
搶	shaŋʔ (七兩切 倉聲 陽)	
搶	shraŋʔ (初兩切 倉聲 陽)	
搷	diːn (徒年切 眞聲 眞1)	
搸	ʔsrin (側詵切 秦聲 眞1)	
搹	kreːɡ (古核切 鬲聲 錫)	
携	ɡʷleː (戸圭切 巂聲 支)	俗攜字
搽	rlaː (宅加切 余聲 魚)	塗晚起分化字
摇	lews (弋照切 謠聲 宵2)	
摇	lew (餘昭切 謠聲 宵3)	
摋	slaːd (桑割切 杀聲 月1)	
摌	sreːnʔ (所簡切 彦聲 元2)	
摍	sruɡ (所六切 宿聲 覺1)	
摎	krɯːw (古肴切 翏聲 幽2)	
摎	rɯw (力求切 翏聲 幽2)	
摏	hljoŋ (書容切 舂聲 東)	見左傳
摐	shroːŋ (楚江切 从聲 東)	見子虛賦
摐	shloŋ (七恭切 从聲 東)	見太玄
摑	kʷrɯːɡ (古獲切 或聲 職)	
摒	peŋs (畀政切 并聲 耕)	
摕	teːds (都計切 帶聲 祭2)	
摕	deːds (特計切 帶聲 祭2)	
摕	deːd (徒結切 帶聲 月2)	
摖	shleːds (七計切 祭聲 祭2)	
摗	sloː (速侯切 束聲 侯)	
摘	rteːɡ (陟革切 帝聲 錫)	
摘	tʰeːɡ (他歷切 帝聲 錫)	
摙	renʔ (力展切 連聲 元2)	
摙	rens (連彦切 連聲 元2)	有的本子誤漣
摛	r̥ʰel (丑知切 离聲 歌2)	
摜	kroːns (古患切 毌聲 元3)	
摝	roːɡ (盧谷切 鹿聲 屋)	見周禮
摞	roːl (落戈切 畾聲 歌3)	
摞	roːls (魯過切 畾聲 歌3)	
摟	roː (落侯切 婁聲 侯)	
摟	ro (力朱切 婁聲 侯)	
摡	kɯːds (古代切 旡聲 隊1)	手冊直以此代槩集韻注雲亦作概
摡	qʰɯds (許既切 旡聲 隊1)	
摣	rnaː (女加切 且聲 魚)	見方言
摣	ʔsraː (莊加切 且聲 魚)	正體依說文從又，方言作此，郭注仄加反
摤	shlaŋʔ (七兩切 爽聲 陽)	同搶
摦	ɡʷraːs (胡化切 于聲 魚)	見左傳
摧	zluːl (昨回切 崔聲 微2)	
摨	rniːd (諾皆切 犀聲 質1)	諾由諧校改
摩	maːl (莫婆切 麻聲 歌1)	
摩	maːls (模臥切 麻聲 歌1)	
摫	kʷel (居隋切 規聲 歌3)	
摬	qraŋʔ (於丙切 竟聲 陽)	
摭	tjaːɡ (之石切 庶聲 鐸)	說文作拓
摮	ŋaːw (五勞切 敖聲 宵1)	
摯	tjibs (脂利切 執聲 位2)	
摲	shraːms (楚鑑切 斬聲 談1)	
摳	kʰoː (恪侯切 區聲 侯)	
摳	kʰo (豈俱切 區聲 侯)	
摴	qʰʷl'a (丑居切 于聲 魚)	
摵	srɯːɡ (山責切 尗聲 職)	
摵	ʔslɯwɢ (子六切 尗聲 覺2)	見方言
摵	srɯwɢ (所六切 尗聲 覺2)	見方言
摶	doːn (度官切 專聲 元3)	
摶	donʔ (持兖切 專聲 元3)	
摷	ʔsraːw (側交切 巢聲 宵1)	
摷	raːw (落蕭切 巢聲 宵1)	
摸	maː (莫胡切 莫聲 魚)	注亦作摹，見方言
摸	maːɡ (慕各切 莫聲 鐸)	
摹	maː (蒙晡切 莫聲 魚)	廣韻作摸或體
摺	ruːb (盧合切 習聲 緝3)	
摺	ʔljob (之涉切 習聲 盍3)	說文爲另義敗
摻	sruːm (所咸切 參聲 侵3)	
摻	sruːmʔ (所斬切 參聲 侵3)	
摼	kʰreːŋ (口莖切 臣聲 耕)	
摽	pʰew (撫招切 票聲 宵2)	
摽	pʰews (匹妙切 票聲 宵2)	
摽	bewʔ (符少切 票聲 宵2)	符由苻校正
撅	kod (居月切 欮聲 月3)	
撅	ɡod (其月切 欮聲 月3)	
撆	pʰeːd (普蔑切 敝聲 月2)	
撇	pʰeːd (普蔑切 敝聲 月2)	撆注或體
撈	raːw (魯刀切 勞聲 宵1)	見通俗文
撈	reːw (憐蕭切 勞聲 宵2)	見方言
撊	ɡraːnʔ (下赧切 閒聲 元1)	
撋	njon (而緣切 閏聲 元3)	
撍	ʔsluːm (作含切 兓聲 侵3)	
撍	ʔsluːmʔ (子感切 兓聲 侵3)	
撍	ʔsluːms (作紺切 兓聲 侵3)	
撍	ʔsrum (側吟切 兓聲 侵3)	
撎	qriɡs (乙冀切 壹聲 至2)	
撏	zluːm (昨含切 尋聲 侵3)	見方言
撏	ɦljom (視占切 尋聲 談3)	見方言
撏	ljum (徐林切 尋聲 侵3)	見方言
撐	rtʰaːŋ (丑庚切 尚聲 陽)	橕分化字見漢書，今更作撐
撒	saːd (桑割切 散聲 月1)	說文作殺下米
撓	hŋaːw (呼毛切 垚聲 宵1)	
撓	rŋaːw (尼交切 垚聲 宵1)	
撓	rnaːwʔ (奴巧切 垚聲 宵2)	
撕	seː (先稽切 斯聲 支)	見詩鄭箋
撕	se (相支切 斯聲 支)	同斯，後分化字
撖	kʰɯːm (口含切 敢聲 侵1)	
撖	kʰreːmʔ (苦減切 敢聲 談2)	
撖	ɡraːmʔ (胡黤切 敢聲 談1)	
撘	tuːb (都合切 合聲 緝3)	
撙	ʔsuːnʔ (兹損切 尊聲 文2)	
撚	neːnʔ (乃殄切 肰聲 元2)	
撛	rinʔ (良忍切 粦聲 眞1)	
撛	rins (良刃切 粦聲 眞1)	
撜	tjɯŋʔ (支庱切 登聲 蒸)	同抍原音蒸上聲無切語，此依五音集韻補
撝	qʰʷral (許爲切 爲聲 歌1)	
撞	rdoːŋ (宅江切 重聲 東)	
撞	rdoːŋs (直絳切 重聲 東)	
撟	krew (舉喬切 喬聲 宵2)	
撟	krewʔ (居夭切 喬聲 宵2)	
撠	kraɡ (几劇切 戟聲 鐸)	見史記
撢	l̥ʰɯːm (他含切 覃聲 侵1)	
撢	l'ɯːms (他紺切 覃聲 侵1)	通作探
撢	lɯm (餘針切 覃聲 侵1)	
撢	ʔl'aːnʔ/taːnʔ (多旱切 覃聲 元1)	玉篇擔（丁但切，拂也）今字。或雲即內則膽、字林抌字，通用多作撣
撣	daːn (徒干切 單聲 元1)	
撣	daːnʔ (蕩旱切 單聲 元1)	
撣	daːns (徒案切 單聲 元1)	
撣	djan (市連切 單聲 元1)	
撣	taːnʔ (多旱切 單聲 元1)	玉篇擔（丁但切，拂也）今字。亦作撢
撤	tʰed (丑列切 徹聲 月2)	
撤	ded (直列切 徹聲 月2)	徹轉註字
撥	paːd (北末切 發聲 月1)	
撦	l̥ʰjaːʔ (昌者切 者聲 魚)	後作扯
撨	zew (昨焦切 焦聲 宵2)	
撨	seːw (蘇彫切 焦聲 宵2)	
撩	reːw (落蕭切 尞聲 宵2)	
撩	reːwʔ (盧鳥切 尞聲 宵2)	
撫	m̥ʰaʔ (芳武切 無聲 魚)	
播	paːls (補過切 番聲 歌1)	
撮	ʔsoːd (子括切 取聲 月3)	
撮	shoːd (倉括切 取聲 月3)	
撰	sɡroːnʔ (雛鯇切 巽聲 元3)	
撰	sɡronʔ (士免切 巽聲 元3)	集韻改雛免切以與棧別
撱	lolʔ (羊捶切 隓聲 歌3)	
撲	broːɡ (蒲角切 菐聲 屋)	原從僕注或作撲，見太玄
撲	pʰoːɡ (普木切 菐聲 屋)	
撳	kʰrɯms (丘禁切 金聲 侵1)	搇今字
撻	tʰaːd (他達切 羍聲 月1)	
撼	ɡɯːmʔ (胡感切 咸聲 侵1)	見漢賦
撿	ɡ·ramʔ (良冉切 僉聲 談1)	
撿	kramʔ (居奄切 僉聲 談1)	見漢書
擀	kaːnʔ (古旱切 干聲 元1)	與衦同源
擁	qoŋ (於容切 邕聲 東)	
擁	qoŋʔ (於隴切 邕聲 東)	
擂	ruːl (盧回切 畾聲 微2)	攂後起字：研
擂	ruːls (盧對切 畾聲 微2)	攂後起字擊鼓
擃	rnuːŋʔ (匿講切 農聲 終)	
擄	raːʔ (郎古切 虍聲 魚)	虜或體見東觀漢記
擅	djans (時戰切 旦聲 元1)	
擆	taɡ (張略切 者聲 鐸)	廣雅從箸
擇	rlaːɡ (場伯切 睪聲 鐸)	
擉	shroːɡ/rtʰoːɡ (測角切 蜀聲 屋)	見莊子釋文初角反又敕角反
擊	keːɡ (古歷切 毄聲 錫)	
擋	taːŋʔ (多朗切 尚聲 陽)	當分化字或作攩
擋	taːŋs (丁浪切 尚聲 陽)	
擌	sreːɡ (山責切 朿聲 錫)	
操	shaːw (七刀切 喿聲 宵1)	
操	shaːws (七到切 喿聲 宵1)	
擎	ɡreŋ (渠京切 敬聲 耕)	見莊子
擐	kʷraːn (古還切 睘聲 元1)	
擐	ɡʷraːns (胡慣切 睘聲 元1)	
擒	ɡrɯm (巨金切 今聲 侵1)	同捦，禽轉註字
擓	kʰʷriːl (苦淮切 唯聲 脂1)	原無氵
擔	taːm (都甘切 詹聲 談1)	見國語說文作儋
擔	taːms (都濫切 詹聲 談1)	
擖	kʰreːd (恪八切 曷聲 月2)	
擖	kraːd (古鎋切 曷聲 月1)	
擖	r'aːb (丈甲切 巤聲 盍1)	右葛爲巤書訛
擗	beɡ (房益切 辟聲 錫)	
擘	preːɡ (博厄切 辟聲 錫)	
據	kas (居御切 虍聲 魚)	
擟	mnel (武移切 爾聲 歌2)	
擠	ʔsliːl (祖稽切 齊聲 脂1)	祖由相校改
擠	ʔsliːls (子計切 齊聲 脂1)	
擡	dɯː (徒哀切 臺聲 之)	見通俗文
擢	r'eːwɢ (直角切 翟聲 藥2)	
擣	tuːʔ (都晧切 壽聲 幽1)	
擥	ɡ·raːmʔ (盧敢切 監聲 談1)	
擦	shlaːd (七曷切 祭聲 月1)	手冊作集韻礤摩也新字
擧	la (以諸切 舁聲 魚)	同舁余校上爲輿
擨	laː (以遮切 虒聲 魚)	東觀漢記作邪，後作揶
擩	noːs (奴豆切 需聲 侯)	
擩	njoʔ (而主切 需聲 侯)	
擩	njos (而遇切 需聲 侯)	
擩	njul (儒隹切 需聲 微3)	
擩	njod (如劣切 需聲 月3)	廣韻從耎
擪	qemʔ (於琰切 猒聲 談2)	
擪	qeb (於葉切 猒聲 盍2)	
擬	ŋɯʔ (魚紀切 疑聲 之)	
擭	ɢʷaːɡs (胡誤切 蒦聲 暮)	
擭	ɢʷaːɡ (胡郭切 蒦聲 鐸)	
擭	qʷraːɡ (一虢切 蒦聲 鐸)	
擯	pins (必刃切 賓聲 眞1)	
擱	klaːɡ (古落切 各聲 鐸)	閣字今分化字
擲	deɡ (直炙切 奠聲 錫)	
擳	ʔsriɡ (阻瑟切 即聲 質2)	
擴	ɡʷlaːŋs (乎曠切 黄聲 陽)	同攩
擴	kʰʷaːɡ (闊鑊切 黄聲 鐸)	見孟子
擷	qʰiːd (虎結切 吉聲 質1)	
擷	ɡiːd (胡結切 吉聲 質1)	
擸	raːb (盧盍切 巤聲 盍1)	
擸	rab (良涉切 巤聲 盍1)	
擹	n̥ʰaːn (他干切 暵聲 元1)	
擺	preːlʔ (北買切 罷聲 歌2)	
擻	sloːʔ (蘇后切 婁聲 侯)	方言作藪
擽	rawɢ (離灼切 樂聲 藥1)	
擽	reːwɢ (郎擊切 樂聲 藥2)	見漢賦
擾	njiwʔ (而沼切 夒聲 幽3)	
擿	deɡ (直炙切 帝聲 錫)	同擲出説文
攀	pʰraːn (普班切 棥聲 元1)	
攂	ruːl (盧回切 畾聲 微2)	研物
攂	ruːls (盧對切 畾聲 微2)	
攃	shlaːd (七曷切 祭聲 月1)	後作擦
攃	saːd (桑割切 祭聲 月1)	
攄	r̥ʰa (丑居切 虍聲 魚)	
攅	zoːns (在玩切 贊聲 元3)	見墨子
攆	neːnʔ (乃殄切 輦聲 元2)	蹨（跈趁）新字
攇	qʰanʔ (虚偃切 害聲 元1)	
攈	kuns (居運切 囷聲 文2)	
攉	qʰʷaːɡ (虚郭切 霍聲 鐸)	
攊	reːɡ (郎擊切 秝聲 錫)	
攋	raːds (落蓋切 賴聲 祭1)	原誤襰，依集韻校改
攋	reːdʔ (洛駭切 賴聲 月2)	
攋	raːd (盧達切 賴聲 月1)	見方言
攍	leŋ (以成切 贏聲 耕)	見方言
攎	raː (落胡切 虍聲 魚)	
攏	roːŋʔ (力董切 龍聲 東)	
攐	kʰran (去乾切 寒聲 元1)	
攑	kʰlan (丘言切 舁聲 元1)	
攔	ɡ·raːn (落干切 柬聲 元1)	
攕	sreːm (所咸切 韱聲 談2)	
攖	qeŋ (於盈切 賏聲 耕)	
攗	mril (武悲切 米聲 脂1)	見爾雅，集韻作木旁
攘	njaŋ (汝陽切 襄聲 陽)	
攘	njaŋʔ (如兩切 襄聲 陽)	
攘	njaŋs (人樣切 襄聲 陽)	
攙	zrɯːm (士咸切 毚聲 侵1)	
攙	shraːm (楚銜切 毚聲 談1)	
攛	shoːn (七丸切 竄聲 元3)	
攜	ɡʷeː (戸圭切 巂聲 支)	俗作攜
攝	neːb (奴協切 聶聲 盍2)	見漢書
攝	ʔnjeb (書涉切 聶聲 盍2)	
攡	rel (呂支切 离聲 歌2)	見太玄，說文摛
攢	ʔsaːns (則旰切 贊聲 元1)	
攢	ʔsoːnʔ (作管切 贊聲 元3)	
攣	b·ron (呂員切 龻聲 元3)	
攤	n̥ʰaːn (他干切 暵聲 元1)	
攤	naːnʔ (奴但切 暵聲 元1)	原列緩韻
攤	naːns (奴案切 暵聲 元1)	
攥	ʔsloːd (子括切 算聲 月3)	纂分化字
攨	qʷraːs (烏化切 瓜聲 魚)	同搲廣韻化作口下大
攩	hl'aːŋʔ (他朗切 尚聲 陽)	見方言
攩	ɦʷlaːŋʔ (胡廣切 尚聲 陽)	見方言
攩	ɦʷlaːŋs (乎曠切 尚聲 陽)	見方言
攪	kruːʔ (古巧切 學聲 幽1)	
攫	kʷaɡ (居縛切 矍聲 鐸)	
攬	ɡ·raːmʔ (盧敢切 監聲 談1)	同擥
