#漢字	音標	解釋
㑳	zrus (鋤佑切 芻聲 幽1)	媰轉註分化字
㑳	ʔsro (莊俱切 芻聲 侯)	
㑳	rnuːb (女洽切 芻聲 緝3)	又口旁
㩳	soŋʔ (息拱切 雙聲 東)	
㪻	pʰlons (芳万切 龻聲 元3)	
㪻	klons/kplons (居願切 龻聲 元3)	
㮴	suːw (蘇遭切 叟聲 幽1)	或作艘
䁝	qʷraːŋʔ (烏猛切 熒聲 陽)	
䉛	quɡ (於六切 奧聲 覺1)	
䊮	l'eːwɢ (徒歷切 翟聲 藥2)	
䑣	l̥ʰun (丑林切 彡聲 侵3)	依說文補，羅振玉謂即《書》肜字
䒦	pʰom (匹凡切 乏聲 談3)	
䒦	pʰoms (孚梵切 乏聲 談3)	
䙡	kʰruds (丘愧切 貴聲 隊2)	
䙡	kʰluds (丘畏切 貴聲 隊2)	
䝼	zleŋs (疾政切 生聲 耕)	
䝼	zleŋ (疾盈切 生聲 耕)	
䡩	kʰriːn (丘閑切 眞聲 眞1)	
䣮	boːd (蒲撥切 犮聲 月3)	
䫄	rtʰoːd (丑刮切 兌聲 月3)	
䱷	ŋa (語居切 魚聲 魚)	亦同漁見周禮
䲁	quds (於胃切 尉聲 隊2)	
一	qliɡ (於悉切 一聲 質2)	
丁	rteːŋ (中莖切 丁聲 耕)	
丁	teːŋ (當經切 丁聲 耕)	釘（鋌塊）初文
丂	kʰluːʔ (苦浩切 丂聲 幽1)	古文考
七	sn̥ʰid (親吉切 七聲 質1)	
丄	djaŋʔ (時掌切 上聲 陽)	古文上
丄	djaŋs (時亮切 上聲 陽)	
丅	ɡraːʔ (胡雅切 下聲 魚)	古文下
万	mans (無販切 万聲 元1)	集韻注通作萬
万	mɯːɡ (莫北切 万聲 職)	
丈	daŋʔ (直兩切 丈聲 陽)	
三	suːm (蘇甘切 三聲 侵3)	
三	suːms (蘇暫切 三聲 侵3)	
上	djaŋʔ (時掌切 上聲 陽)	
上	djaŋs (時亮切 上聲 陽)	
下	ɡraːʔ (胡雅切 下聲 魚)	
下	ɡraːs (胡駕切 下聲 魚)	
不	pɯ (甫鳩切 不聲 之)	
不	pɯʔ (方久切 不聲 之)	象花柎與本同源
不	pɯ' (分勿切 不聲 物1)	中古才促化
与	laʔ (余呂切 与聲 魚)	同與，省文
丏	meːnʔ (彌殄切 丏聲 元2)	
丐	kaːds (古太切 丐聲 祭1)	同匃，俗訛變
丐	kaːd (古達切 丐聲 月1)	原作匃，此依說文
丑	n̥ʰuʔ (敕久切 丑聲 幽1)	
且	shjaːʔ (七也切 且聲 魚)	甲文象男根崇拜所之且，爲祖初文（郭沫若）
且	ʔsa (子魚切 且聲 魚)	
丕	pʰrɯ (敷悲切 不聲 之)	不的轉註字
世	hljebs (舒制切 世聲 蓋2)	本枼葉初文（文源）
丘	kʰʷɯ (去鳩切 丘聲 之)	
丙	pqraŋʔ (兵永切 丙聲 陽)	甲文象二石相對並，與竝同源，後轉註爲兩。又史諱通景
丞	ɡljɯŋ (署陵切 丞聲 蒸)	拯之初文
丞	ɡljɯŋs (常證切 丞聲 蒸)	
丠	kʰʷɯ (去鳩切 丘聲 之)	古文丘
丣	luʔ (與久切 酉聲 幽1)	酉古文
並	beːŋʔ (蒲迥切 並聲 耕)	同竝，隸變爲並
丨	kuːnʔ (古本切 丨聲 文2)	
丩	kɯw (居求切 丩聲 幽2)	
丩	krɯw (居虯切 丩聲 幽2)	注爲今體
个	kaːls (古賀切 个聲 歌1)	分別字
丫	qraː (於加切 丫聲 魚)	椏晚起字
中	tuŋ (陟弓切 中聲 終)	
中	tuŋs (陟仲切 中聲 終)	
丮	kraɡ (几劇切 丮聲 鐸)	
丯	kreːds (古拜切 丯聲 祭2)	原作豐首筆爲撇校本改爲丯
丰	pʰoŋ (敷容切 丰聲 東)	甲文象草木在土上表生長旺盛
丱	kroːns (古患切 丱聲 元3)	
串	kroːns (古患切 串聲 元3)	
串	kʰjons (尺絹切 串聲 元3)	
丳	shreːnʔ (初限切 丳聲 元2)	
丵	zroːwɢ (士角切 凿聲 藥3)	與叢同根
丶	toʔ (知庾切 丶聲 侯)	
丸	ɡʷaːn (胡官切 丸聲 元1)	
丹	taːn (都寒切 丹聲 元1)	
主	tjoʔ (之庾切 主聲 侯)	
丼	kloːmʔ' (都感切 丼聲 談3)	集韻又義與𣿅合，吳方言作澸今字
丼	skeŋʔ (子郢切 井聲 耕)	說文井字
丽	reːls (郎計切 丽聲 歌2)	說文作麗古文
丿	pʰleːd (普蔑切 丿聲 月2)	
丿	leds (餘制切 丿聲 祭2)	
乂	ŋads (魚肺切 乂聲 祭1)	
乃	nɯːʔ (奴亥切 乃聲 之)	
久	kʷlɯʔ (舉有切 久聲 之)	
乇	ʔr'aːɡ (陟格切 乇聲 鐸)	象草拓展根葉，爾雅攫（集韻從瞿）橐作橐
之	tjɯ (止而切 之聲 之)	
乍	zraːɡs (鋤駕切 乍聲 暮)	曾憲通雲甲金文象以耒起土，爲耕作字初文
乎	ɢaː (戸吳切 乎聲 魚)	
乏	bob (房法切 乏聲 盍3)	
乑	ŋrɯm (魚金切 乑聲 侵1)	
乖	kʷrɯːl (古懷切 乖聲 微1)	
乘	ɦljɯŋ (食陵切 乘聲 蒸)	
乘	ɦljɯŋs (實證切 乘聲 蒸)	
乙	qriɡ (於筆切 乙聲 質2)	甲乙字收ɡ尾與燕乙字收d尾小分部有異
乜	mjaːʔ (彌也切 乜聲 魚)	
九	kuʔ (舉有切 九聲 幽1)	
乞	kʰɯds (去既切 乞聲 隊1)	氣字注今體，集韻徑作乞（與）
乞	kʰɯd (去訖切 乞聲 物1)	氣的轉註字從乞與從氣同
也	laːlʔ (羊者切 也聲 歌1)	
乩	kiː (堅奚切 乩聲 脂2)	同卟
乳	njoʔ (而主切 乳聲 侯)	
乾	kaːn (古寒切 倝聲 元1)	
乾	ɡran (渠焉切 倝聲 元1)	
亂	roːns (郎段切 亂聲 元3)	
亄	qriɡs (乙冀切 壹聲 至2)	見方言
亄	qriɡ (於筆切 壹聲 質2)	見方言
了	reːwʔ (盧鳥切 了聲 宵2)	
予	la (以諸切 予聲 魚)	
予	laʔ (余呂切 予聲 魚)	
事	ʔsrɯs (側吏切 史聲 之)	見漢書又作剚倳
事	zrɯs/zrɯʔ (鉏吏切 史聲 之)	史吏轉註字
二	njis (而至切 二聲 脂2)	
亍	toɡs (中句切 亍聲 竇)	
亍	tʰoɡ (丑玉切 亍聲 屋)	
于	ɢʷa (羽俱切 于聲 魚)	王筠雲籲初文
云	ɢun (王分切 云聲 文2)	
互	ɡaːs (胡誤切 互聲 魚)	
五	ŋaːʔ (疑古切 五聲 魚)	
井	skeŋʔ (子郢切 井聲 耕)	丼注今體甲金文爲型初文
亖	hljids (息利切 亖聲 至1)	四籀文
亙	kɯːŋs (古鄧切 亙聲 蒸)	原作亙雲出方言，方言作緪。通行作此字，見漢賦，近甲文與說文㮓古文，中本象上弦月
些	saːls (蘇箇切 此聲 歌1)	見招魂
些	sjaːl (寫邪切 此聲 歌1)	
些	seːs (蘇計切 此聲 支)	
亞	qraːɡs (衣嫁切 亞聲 暮)	
亟	kʰɯɡs (去吏切 茍聲 志)	
亟	kɯɡ (紀力切 茍聲 職)	
亡	maŋ (武方切 亡聲 陽)	
亢	kaːŋ (古郎切 亢聲 陽)	
亢	kʰaːŋs (苦浪切 亢聲 陽)	
交	kreːw (古肴切 交聲 宵2)	
亥	ɡɯːʔ (胡改切 亥聲 之)	甲金文象根荄爲荄之初文，陳獨秀說
亦	laːɡ (羊益切 亦聲 鐸)	
亨	qʰaŋʔ (許兩切 亨聲 陽)	注亦作享
亨	pqʰraːŋ (撫庚切 亨聲 陽)	
亨	qʰraːŋ (許庚切 亨聲 陽)	享分化字
享	qʰaŋʔ (許兩切 亨聲 陽)	說文亯或體
京	kraŋ (舉卿切 京聲 陽)	
亭	deːŋ (特丁切 丁聲 耕)	
亮	raŋs (力讓切 亮聲 陽)	
亯	qʰaŋʔ (許兩切 亯聲 陽)	後作享亨
亳	blaːɡ (傍各切 乇聲 鐸)	
亶	taːnʔ (多旱切 旦聲 元1)	
亹	mɯlʔ (無匪切 釁聲 微1)	
亹	mɯːn (莫奔切 釁聲 文1)	
人	njin (如鄰切 人聲 眞1)	
亼	zub (秦入切 亼聲 緝3)	
什	ɡjub (是執切 十聲 緝3)	
仁	njin (如鄰切 人聲 眞1)	
仂	rɯːɡ (盧則切 力聲 職)	
仂	rɯɡ (林直切 力聲 職)	
仃	teːŋ (當經切 丁聲 耕)	
仄	ʔsrɯɡ (阻力切 仄聲 職)	
仆	pʰoːɡs (匹候切 卜聲 候)	
仆	pʰus (敷救切 卜聲 幽1)	
仆	pʰoɡs (芳遇切 卜聲 竇)	
仆	bɯːɡ (蒲北切 卜聲 職)	
仆	pʰoːɡ (普木切 卜聲 屋)	
仇	ɡu (巨鳩切 九聲 幽1)	
仉	tjaŋʔ (諸兩切 仉聲 陽)	
今	krɯm (居吟切 今聲 侵1)	文源謂含初文
介	kreːds (古拜切 介聲 祭2)	
仍	njɯŋ (如乘切 乃聲 蒸)	
从	zloŋ (疾容切 从聲 東)	
仔	ʔslɯ (子之切 子聲 之)	
仔	ʔslɯʔ (即里切 子聲 之)	
仕	zrɯʔ (鉏里切 士聲 之)	
他	l̥ʰaːl (託何切 也聲 歌1)	俗與佗通用
仗	daŋʔ (直兩切 丈聲 陽)	
仗	daŋs (直亮切 丈聲 陽)	
付	pos/poʔ (方遇切 付聲 侯)	
仙	sen (相然切 山聲 元2)	
仚	qʰren (許延切 仚聲 元2)	
仛	l'aːɡ (徒落切 乇聲 鐸)	
仜	ɡoːŋ (戸公切 工聲 東)	
仝	zlon (疾緣切 全聲 元3)	同全，説文作正體；道書作古文同字
仝	doːŋ (徒紅切 同聲 東)	古文同，出道書，說文同全
仞	njɯns (而振切 刃聲 文1)	
仟	sn̥ʰiːn (蒼先切 人聲 眞1)	見史記
仠	kaːnʔ (古旱切 干聲 元1)	
仡	ŋɯd (魚迄切 乞聲 物1)	
仡	hŋɯd (許訖切 乞聲 物1)	
仢	bljewɢ (市若切 勺聲 藥2)	
代	l'ɯːɡs (徒耐切 弋聲 代)	
令	ren (力延切 令聲 元2)	
令	reŋ (呂貞切 令聲 耕)	
令	reŋs (力政切 令聲 耕)	
令	reːŋ/riːŋ (郎丁切 令聲 耕)	
令	reːŋs (郎定切 令聲 耕)	
以	lɯʔ (羊己切 以聲 之)	
仯	sm̥ʰreːws (初敎切 小聲 宵2)	
仰	ŋaŋʔ (魚兩切 卬聲 陽)	
仰	ŋaŋs (魚向切 卬聲 陽)	
仲	duŋs (直衆切 中聲 終)	
仳	pʰeʔ (匹婢切 比聲 支)	
仳	piʔ (卑履切 比聲 脂2)	符鄙切注又方比切
仳	bi (房脂切 比聲 脂2)	
仳	briʔ (符鄙切 比聲 脂2)	
仵	ŋaːʔ (疑古切 午聲 魚)	
件	ɡranʔ (其輦切 件聲 元1)	見漢印
价	kreːds (古拜切 介聲 祭2)	
仸	qrowʔ (於兆切 夭聲 宵3)	
仹	pʰoŋ (敷容切 丰聲 東)	
任	njɯm (如林切 壬聲 侵1)	
任	njɯms (汝鴆切 壬聲 侵1)	
份	prɯn (府巾切 分聲 文1)	
份	bɯns (扶問切 分聲 文1)	
仿	pʰaŋʔ (妃兩切 方聲 陽)	
伀	kljoŋ (職容切 公聲 東)	
企	kʰeʔ (丘弭切 企聲 支)	
企	kʰes (去智切 企聲 支)	
伂	poːbs (博蓋切 巿聲 祭3)	同沛：顛伂
伃	la (以諸切 予聲 魚)	同妤
伄	tiːwɢs (多嘯切 弔聲 奧3)	
伆	mɯnʔ (武粉切 勿聲 文1)	見方言
伆	mɯd (文弗切 勿聲 物1)	見方言
伈	slɯmʔ (斯甚切 心聲 侵1)	
伉	kʰaːŋs (苦浪切 亢聲 陽)	
伊	qlil (於脂切 尹聲 脂1)	說文古文死聲，小徐雲俗本作尹聲
伋	krɯb (居立切 及聲 緝1)	
伍	ŋaːʔ (疑古切 五聲 魚)	
伎	kjes (支義切 支聲 支)	
伎	ɡe (巨支切 支聲 支)	
伎	ɡreʔ (渠綺切 支聲 支)	
伏	bɯɡs (扶富切 伏聲 代)	
伏	bɯɡ (房六切 伏聲 職)	
伐	bad (房越切 伐聲 月3)	
休	qʰu (許尤切 休聲 幽1)	
伙	qʰʷaːlʔ (呼果切 火聲 歌1)	火今分化字
伭	ɡeːn (胡田切 玄聲 元2)	
伯	praːɡ (博陌切 白聲 鐸)	
估	kaːʔ (公戸切 古聲 魚)	
伴	baːnʔ (蒲旱切 半聲 元1)	
伴	baːns (薄半切 半聲 元1)	
伶	reːŋ (郎丁切 令聲 耕)	
伷	l'ɯwɢs (直祐切 由聲 奧2)	集韻同胄
伸	hlin (失人切 申聲 眞1)	
伹	zaːʔ (徂古切 且聲 魚)	
伹	sha (七余切 且聲 魚)	
伺	slɯ (息兹切 司聲 之)	
伺	slɯs (相吏切 司聲 之)	
伻	pʰreːŋ (普耕切 平聲 耕)	
似	ljɯʔ (詳里切 以聲 之)	說文做佀金文從臺
伽	ɡa (求迦切 加聲 魚1)	譯音字，僧伽saṃɡha
伽	ɡal (求迦切 加聲 歌1)	
伾	pʰrɯ (敷悲切 不聲 之)	
伿	kljes (支義切 只聲 支)	
伿	les (以豉切 只聲 支)	
佀	ljɯʔ (詳里切 以聲 之)	同似
佁	lɯːʔ (夷在切 台聲 之)	
佁	l̥ʰɯs (丑吏切 台聲 之)	見史記
佁	lɯʔ (羊己切 台聲 之)	
佂	tjeŋ (諸盈切 正聲 耕)	見方言
佃	l'iːŋ (徒年切 田聲 眞2)	
佃	l'iːŋs (堂練切 田聲 眞2)	
佅	mraːds (莫話切 末聲 祭1)	見班固賦，本應從末
但	daːn (徒干切 旦聲 元1)	通作袒
但	daːnʔ (徒旱切 旦聲 元1)	
但	daːns (徒案切 旦聲 元1)	
佇	daʔ (直呂切 宁聲 魚)	
佈	paːs (博故切 父聲 魚)	
佉	kʰal/kʰa (丘伽切 去聲 歌1)	梵譯字
佊	pralʔ (甫委切 皮聲 歌1)	
佊	prals (彼義切 皮聲 歌1)	
佋	djew (市昭切 刀聲 宵2)	
佋	djewʔ (市沼切 刀聲 宵2)	
佌	sheʔ (雌氏切 此聲 支)	
佌	seʔ (斯氏切 此聲 支)	𠈈注亦作佌
位	ɢʷrɯbs (于愧切 立聲 內1)	
低	tiːl (都奚切 氐聲 脂1)	
住	tos (中句切 主聲 侯)	
住	dos (持遇切 主聲 侯)	
佐	ʔsaːls (則箇切 左聲 歌1)	
佑	ɢʷɯs (于救切 又聲 之)	
佒	qaːŋ (烏郎切 央聲 陽)	見莊子
体	bɯːnʔ (蒲本切 本聲 文1)	晉書作笨
佔	tjems (章豔切 占聲 談2)	佔分化新字
佔	teːm (丁兼切 占聲 談2)	
何	ɡaːl (胡歌切 可聲 歌1)	
何	ɡaːlʔ (胡可切 可聲 歌1)	同荷
佖	bliɡ (毗必切 必聲 質2)	
佖	briɡ (房密切 必聲 質2)	
佗	l̥ʰaːl (託何切 它聲 歌1)	
佗	l'aːl (徒河切 它聲 歌1)	
佘	ɦlja (視遮切 余聲 魚)	余晚起分化字，集韻已作或體
余	la (以諸切 余聲 魚)	說文舍省聲，甲文即象居舍初文
佚	liɡ (夷質切 失聲 質2)	
佛	bɯd (符弗切 弗聲 物1)	
作	ʔsaːɡs (則箇切 乍聲 暮)	
作	ʔsaːɡs (臧祚切 乍聲 暮)	祚原誤衤旁巾箱本不誤
作	ʔsaːɡ (則落切 乍聲 鐸)	乍轉註字
佝	qʰoːs/qʰloːs (呼漏切 句聲 侯)	說文佝另一音義
佞	neːŋs (乃定切 人聲 耕)	小徐仁聲
佟	duːŋ (徒冬切 冬聲 終)	
你	nɯʔ (乃里切 尔聲 之)	爾汝音變
佣	loŋs (余頌切 用聲 東)	用的今分化字
佩	bɯːs (蒲昧切 佩聲 之)	
佪	ɡuːl (戸恢切 回聲 微2)	見潛夫論
佫	ɡlaːɡ (下各切 各聲 鐸)	
佮	tkʰuːb/kʰl'uːb (他合切 合聲 緝3)	
佮	kuːb (古沓切 合聲 緝3)	
佮	quːb (烏合切 合聲 緝3)	
佯	zlaŋ (在良切 羊聲 陽)	
佯	laŋ (與章切 羊聲 陽)	
佰	mbraːɡ (莫白切 白聲 鐸)	
佳	kreː (古膎切 圭聲 支)	
佴	nɯːs (奴代切 耳聲 之)	
佴	njɯs (仍吏切 耳聲 之)	
併	breːŋʔ (蒲幸切 并聲 耕)	原右作並此爲注內或體
併	breːŋs (蒲迸切 并聲 耕)	原右作並
併	peŋʔ (必郢切 并聲 耕)	
併	peŋs (畀政切 并聲 耕)	
併	beːŋʔ (蒲迥切 并聲 耕)	
佶	ɡlid (其吉切 吉聲 質1)	
佶	ɡrid (巨乙切 吉聲 質1)	
佸	koːd (古活切 桰聲 月3)	
佸	ɡoːd (戸括切 桰聲 月3)	
佹	krolʔ (過委切 危聲 歌3)	
佺	shlon (此緣切 全聲 元3)	
佻	l̥ʰeːw (吐彫切 兆聲 宵2)	
佻	l'eːw (徒聊切 兆聲 宵2)	
佼	kreːw (古肴切 交聲 宵2)	
佼	kreːwʔ (古巧切 交聲 宵2)	
佼	ɡreːwʔ (下巧切 交聲 宵2)	
佽	sl̥ʰis (七四切 次聲 脂2)	
佾	lɯd (夷質切 佾聲 質1)	
使	srɯʔ (踈士切 史聲 之)	
使	srɯs (踈吏切 史聲 之)	
侀	ɡeːŋ (戸經切 井聲 耕)	
侁	srin (所臻切 先聲 眞1)	
侂	l̥ʰaːɡ (他各切 乇聲 鐸)	
侃	kʰaːnʔ (空旱切 侃聲 元1)	
侃	kʰaːns (苦旰切 侃聲 元1)	
侄	diɡ (直一切 至聲 質2)	姪今字
侄	tjiɡ (之日切 至聲 質2)	已見金文
侅	kɯː (古哀切 亥聲 之)	
侅	kʰɯː (苦哀切 亥聲 之)	
侅	ɡɯːʔ (胡改切 亥聲 之)	
侅	ɡrɯːʔ (侯楷切 亥聲 之)	
來	m·rɯːɡ (落哀切 來聲 之)	
侈	l̥ʰjalʔ (尺氏切 多聲 歌1)	
侉	qaːls (安賀切 于聲 歌1)	原列過韻說文憊義音苦瓜切
侊	kʷaːŋ (古黄切 光聲 陽)	
侊	kʷraːŋ (古橫切 光聲 陽)	
例	reds (力制切 列聲 祭2)	
侍	djɯs (時吏切 寺聲 之)	
侎	meʔ (綿婢切 米聲 支)	說文同敉
侏	tjo (章俱切 朱聲 侯)	
侐	qʰʷiɡs (火季切 血聲 質2)	
侐	qʰʷɯɡ (況逼切 血聲 職)	
侑	ɢʷɯs (于救切 又聲 之)	甲文作屮下一，象祭升牛牲首
侒	qaːn (烏寒切 安聲 元1)	
侔	mu (莫浮切 牟聲 幽1)	
侖	run (力迍切 侖聲 文2)	
侗	tʰoːŋ (他紅切 同聲 東)	
侗	tʰoːŋʔ (他孔切 同聲 東)	
侗	doːŋ (徒紅切 同聲 東)	
侘	hr'aː (敕加切 乇聲 魚)	
侘	hr'aːɡs (丑亞切 乇聲 暮)	
侙	l̥ʰɯɡ (恥力切 弋聲 職)	
侚	sɢʷins (辭閏切 勻聲 眞1)	
供	kloŋ (九容切 共聲 東)	
供	kloŋs (居用切 共聲 東)	
侜	tɯw (張流切 舟聲 幽2)	
依	qɯl (於希切 衣聲 微1)	
侣	raʔ (力舉切 呂聲 魚)	見王襃論
侯	ɡoː (戶鉤切 侯聲 侯)	矦隸變
侲	tjɯn (職鄰切 辰聲 文1)	原作側鄰切
侲	tjɯn (章刃切 辰聲 文1)	
侳	ʔsal/ʔsoːls (子𩨷切 坐聲 歌3)	王韻子過反
侳	ʔsoːls (則臥切 坐聲 歌3)	
侵	shim (七林切 侵聲 侵2)	甲金文象持帚驅策牛豕以至人，穀樑傳隱五年：苞人民毆牛馬曰侵
侷	ɡoɡ (渠玉切 局聲 屋)	局分化字
侸	toː (當侯切 豆聲 侯)	
侹	l̥ʰeːŋʔ (他鼎切 廷聲 耕)	
侹	l̥ʰeːŋs (他定切 廷聲 耕)	
侺	ɡjɯms (時鴆切 今聲 侵1)	
侻	l̥ʰoːd (他括切 兌聲 月3)	
便	ben (房連切 便聲 元2)	金文象執鞭抽人背，右爲鞭初文，非更字
便	bens (婢面切 便聲 元2)	
俁	ŋʷaʔ (虞矩切 吳聲 魚)	
係	keːɡs (古詣切 系聲 賜)	
促	shoɡ (七玉切 足聲 屋)	
俄	ŋaːl (五何切 我聲 歌1)	
俅	ɡu (巨鳩切 求聲 幽1)	
俆	lja (似魚切 余聲 魚)	
俇	ɡʷaŋʔ (求往切 王聲 陽)	
俊	ʔsluns (子峻切 允聲 文2)	同儁
俋	r'ɯb (直立切 邑聲 緝3)	見莊子
俌	paʔ (方矩切 甫聲 魚)	
俌	pʰaʔ (芳武切 甫聲 魚)	
俍	raːŋʔ (盧黨切 良聲 陽)	
俎	ʔsraʔ (側呂切 且聲 魚)	
俏	shews (七肖切 肖聲 宵2)	
俑	l̥ʰoːŋ (他紅切 用聲 東)	
俑	loŋʔ (余隴切 用聲 東)	
俒	ɦŋuːn (戸昆切 元聲 文2)	
俒	ɦŋuːns (胡困切 元聲 文2)	
俓	ŋɡeːn (五堅切 坙聲 元2)	
俓	ŋɡreːŋ (五莖切 坙聲 耕)	
俓	keːŋs (古定切 坙聲 耕)	見爾雅老子
俔	kʰeːns (苦甸切 見聲 元2)	
俔	ɡeːnʔ (胡典切 見聲 元2)	
俕	sluːms (蘇紺切 宋聲 侵3)	
俖	pʰɯːʔ (普乃切 不聲 之)	
俗	ljoɡ (似足切 谷聲 屋)	
俘	pʰuw (芳無切 孚聲 幽1)	更古音滯後
俙	hlɯl (香衣切 希聲 微1)	
俙	hlɯlʔ (虚豈切 希聲 微1)	
俚	rɯʔ (良士切 里聲 之)	
俛	mronʔ (亡辨切 免聲 元3)	注：俯俛
俜	pʰleːŋ (普丁切 甹聲 耕)	
俜	pʰleŋs (匹正切 甹聲 耕)	
保	puːʔ (博抱切 保聲 幽1)	
俞	l̥ʰus (丑救切 俞聲 幽1)	
俞	lo (羊朱切 俞聲 侯)	金文象以銳器刳木爲舟
俟	sɢrɯʔ (牀史切 矣聲 之)	
俟	ɡlɯl (渠希切 矣聲 微1)	万俟
俠	ɡeːb (胡頰切 夾聲 盍2)	
信	hljins (息晉切 信聲 眞1)	金文或從人從口，本指操信符傳言之信使，故表可信，或從言身聲
修	slɯw (息流切 攸聲 幽2)	
俯	poʔ/mpoʔ (方矩切 付聲 侯)	訓讀同頫
俰	ɡoːls (胡臥切 禾聲 歌3)	
俱	ko (舉朱切 具聲 侯)	
俱	ɡos (其遇切 具聲 侯)	具今分化字
俳	brɯːl (步皆切 非聲 微1)	
俴	ʔslenʔ (即淺切 戔聲 元2)	
俴	zlenʔ (慈演切 戔聲 元2)	
俵	praws (方廟切 表聲 宵1)	
俶	l̥ʰjɯwɢ (昌六切 尗聲 覺2)	
俸	poːŋʔ (邊孔切 丰聲 東)	
俸	boŋs (扶用切 丰聲 東)	
俹	qraːɡs (衣嫁切 亞聲 暮)	
俺	qromʔ (於驗切 奄聲 談3)	奄轉註
俺	qoms (於劒切 奄聲 談3)	原列梵韻依王韻改釅
俻	brɯɡs (平祕切 備聲 代)	同備俗
倀	tʰaŋ (褚羊切 長聲 陽)	
倀	rtaːŋs (猪孟切 長聲 陽)	
倃	kɯːw (古勞切 咎聲 幽2)	
倃	ɡɯwʔ (其九切 咎聲 幽2)	
倄	ɢraːw (胡茅切 爻聲 宵1)	
倄	ɢʷɯːʔ (于罪切 又聲 之)	取侑爲聲（比雅直作侑），集韻改於罪切
倅	shuːds (七內切 卒聲 隊2)	七由士校改
倅	ʔsuːd (臧沒切 卒聲 物2)	
倆	raŋʔ (里養切 兩聲 陽)	
倇	qonʔ (於阮切 夗聲 元3)	
倈	rɯ (里之切 來聲 之)	見漢書
倉	shaːŋ (七岡切 倉聲 陽)	
個	kaːls (古賀切 古聲 歌1)	見儀禮鄭注
倌	koːn (古丸切 官聲 元3)	
倌	kroːns (古患切 官聲 元3)	
倍	bɯːʔ (薄亥切 咅聲 之)	
倏	hljɯwɢ (式竹切 攸聲 覺2)	原訛倐依説文集韻改
倐	hljɯwɢ (式竹切 攸聲 覺2)	倏俗訛字
倒	taːwʔ (都晧切 刀聲 宵1)	見漢賦
倒	taːws (都導切 刀聲 宵1)	
倓	l'oːmʔ (徒感切 炎聲 談3)	
倓	l'aːm (徒甘切 炎聲 談1)	
倓	l'aːms (徒濫切 炎聲 談1)	
倔	ɡlud (衢物切 出聲 物2)	
倕	djol (是爲切 垂聲 歌3)	
倖	ɡreːŋʔ (胡耿切 幸聲 耕)	
倗	pʰɯːŋʔ (普等切 朋聲 蒸)	
倗	bɯːŋ (步崩切 朋聲 蒸)	
倗	bɯːŋs (父鄧切 朋聲 蒸)	
倘	tʰaːŋʔ (坦朗切 尚聲 陽)	後作儻字用
候	ɡoːs (胡遘切 侯聲 侯)	
倚	qralʔ (於綺切 奇聲 歌1)	
倚	qrals (於義切 奇聲 歌1)	
倜	tʰɯːwɢ (他歷切 周聲 覺2)	
倝	kaːns (古案切 倝聲 元1)	
倞	ɡraŋs (渠敬切 京聲 陽)	
借	ʔsjaːɡs (子夜切 昔聲 暮)	
借	ʔsjaːɡ (資昔切 昔聲 鐸)	
倠	qʰʷi (許維切 唯聲 脂2)	
倡	tʰjaŋ (尺良切 昌聲 陽)	
倡	tʰjaŋs (尺亮切 昌聲 陽)	
倢	zeb (疾葉切 疌聲 盍2)	
倣	paŋʔ (分网切 方聲 陽)	
倥	kʰoːŋ (苦紅切 工聲 東)	
倥	kʰoːŋʔ (康董切 工聲 東)	
倥	kʰoːŋs (苦貢切 工聲 東)	
倦	ɡrons (渠卷切 卷聲 元3)	
倧	ʔsuːŋ (作冬切 宗聲 終)	
倨	kas (居御切 古聲 魚)	
倩	shleːns/shliːns (倉甸切 生聲 元2)	
倩	shleŋs (七政切 生聲 耕)	
倪	ŋeː (五稽切 兒聲 支)	
倫	run (力迍切 侖聲 文2)	
倬	rteːwɢ (竹角切 卓聲 藥2)	
倭	qoːl (烏禾切 委聲 歌3)	見漢書
倭	qoːlʔ (烏果切 委聲 歌3)	
倭	qrol (於爲切 委聲 歌3)	
倯	sqʰloŋ (息恭切 公聲 東)	
倰	rɯːŋ (魯登切 夌聲 蒸)	
倱	ɡuːnʔ (胡本切 昆聲 文2)	見通俗文
倲	toːŋ (德紅切 東聲 東)	
倳	ʔsrɯs (側吏切 史聲 之)	同事
值	dɯɡs (直吏切 直聲 代)	
值	dɯɡ (逐力切 直聲 職)	
偁	tʰjɯŋ (處陵切 爯聲 蒸)	
偃	qanʔ (於幰切 妟聲 元1)	
偄	noːns (奴亂切 耎聲 元3)	
偄	njonʔ (而兖切 耎聲 元3)	
偅	tjoŋs (之用切 重聲 東)	
偆	tʰunʔ (癡準切 屯聲 文2)	
偆	tʰjunʔ (尺尹切 屯聲 文2)	
假	kraːʔ (古疋切 叚聲 魚)	
假	kraːs (古訝切 叚聲 魚)	
偈	ɡrads (其憩切 曷聲 祭1)	梵譯ɡātha
偈	ɡrad (渠列切 曷聲 月1)	
偉	ɢʷɯlʔ (于鬼切 韋聲 微2)	
偋	beŋs (防正切 并聲 耕)	
偎	quːl (烏恢切 畏聲 微2)	
偏	pʰen (芳連切 扁聲 元2)	
偏	pʰens (匹戰切 扁聲 元2)	
偐	ŋraːns (五晏切 彦聲 元1)	同贗
偑	plum (方戎切 凡聲 侵3)	
偒	l̥ʰaːŋʔ (他朗切 昜聲 陽)	
偓	qroːɡ (於角切 屋聲 屋)	
偔	ŋaːɡ (五各切 屰聲 鐸)	
偕	kriːl (古諧切 皆聲 脂1)	
偘	kʰaːns (苦旰切 侃聲 元1)	同侃書法訛變
偙	teːɡs (都計切 帝聲 賜)	
做	ʔsaːɡs (臧祚切 作聲 暮)	作字注俗體，作（廣韻臧祚切）之晚起字
偛	ʔsreːb (側洽切 臿聲 盍2)	
停	deːŋ (特丁切 丁聲 耕)	
偝	bɯːɡs (蒲昧切 北聲 代)	
偞	leb (與涉切 世聲 盍2)	
偞	hleːb (呼牒切 世聲 盍2)	
偟	ɡʷaːŋ (胡光切 王聲 陽)	
偠	qeːwʔ (烏晈切 要聲 宵2)	見漢賦
偡	r'uːmʔ (徒減切 甚聲 侵3)	
偤	lu (以周切 酉聲 幽1)	
健	ɡans (渠建切 建聲 元1)	
偩	bɯʔ (房久切 負聲 之)	見樂記
偪	prɯɡ (彼側切 畐聲 職)	
偪	pɯɡ (方六切 畐聲 職)	
偬	ʔsloːŋʔ (作孔切 囱聲 東)	見楚辭九嘆
偬	ʔsloːŋs (作弄切 囱聲 東)	
偭	menʔ (彌兖切 面聲 元2)	
偭	mens (彌箭切 面聲 元2)	
偯	qɯlʔ (於豈切 衣聲 微1)	
偰	sqʰeːd (先結切 丯聲 月2)	
偲	sn̥ʰɯː (倉才切 囟聲 之)	
偲	snɯ (息兹切 囟聲 之)	
偳	toːn (多官切 耑聲 元3)	
偳	tʰoːn (他端切 耑聲 元3)	
側	ʔsrɯɡ (阻力切 則聲 職)	
偵	rtaːŋs (猪孟切 貞聲 陽)	
偵	tʰeŋ (丑貞切 貞聲 耕)	
偵	tʰeŋs (丑鄭切 貞聲 耕)	
偶	ŋoːʔ (五口切 禺聲 侯)	
偶	ŋoːs (五遘切 禺聲 侯)	
偷	l̥ʰoː (託侯切 俞聲 侯)	
傀	kuːl (公回切 鬼聲 微2)	
傀	kʰuːlʔ (口猥切 鬼聲 微2)	
傁	suːʔ (蘇后切 叟聲 幽1)	同叟見左傳
傂	sle (息移切 虒聲 支)	
傂	l'e (直離切 虒聲 支)	
傂	l'eʔ (池爾切 虒聲 支)	
傃	saːs (桑故切 素聲 魚)	見禮記鄭注
傄	qʰʷriːd (呼八切 昚聲 質1)	
傅	paɡs (方遇切 甫聲 暮)	
傆	ŋʷans (魚怨切 原聲 元1)	
傉	nuːɡ (內沃切 辱聲 覺1)	
傋	kroːŋʔ (古項切 冓聲 東)	
傋	qʰroːŋʔ (虚慃切 冓聲 東)	
傌	mraːs (莫駕切 馬聲 魚)	又刑義見新書
傍	baːŋ (步光切 方聲 陽)	
傍	baːŋs (蒲浪切 方聲 陽)	
傎	tiːn (都年切 眞聲 眞1)	見穀樑傳
傏	l'aːŋ (徒郎切 庚聲 陽)	
傑	ɡrad (渠列切 桀聲 月1)	
傒	ɡeː (胡雞切 奚聲 支)	
傓	hljens (式戰切 扇聲 元2)	
傔	kʰeːms (苦念切 兼聲 談2)	
傕	kroːwɢ (古岳切 寉聲 藥3)	漢人名
傖	shaːŋ (千岡切 倉聲 陽)	
傖	zraːŋ (助庚切 倉聲 陽)	
傗	l̥ʰuɡ (丑六切 畜聲 覺1)	
傘	saːnʔ (蘇旱切 傘聲 元1)	已見秦簡說文作繖
備	brɯɡs (平祕切 備聲 代)	
傚	ɡreːws (胡敎切 交聲 宵2)	
傛	loŋ (餘封切 谷聲 東)	
傛	loŋʔ (余隴切 谷聲 東)	
傜	lew (餘昭切 謠聲 宵3)	
傝	tʰoːms (他紺切 蹋聲 談3)	
傝	tʰaːb (吐盍切 蹋聲 盍1)	
傞	shlaːl (七何切 左聲 歌1)	
傞	slaːl (素何切 左聲 歌1)	
傢	kraː (古牙切 家聲 魚)	家晚起分化字
傪	shluːm (倉含切 參聲 侵3)	
傪	shluːmʔ (七感切 參聲 侵3)	
催	shluːl (倉回切 崔聲 微2)	
傭	l̥ʰoŋ (丑凶切 用聲 東)	
傭	loŋ (餘封切 用聲 東)	庸轉註字見莊子
傮	ʔsluː (作曹切 曹聲 幽1)	
傯	ʔsloːŋʔ (作孔切 囱聲 東)	今同傯
傱	sloŋʔ (息拱切 从聲 東)	見漢書
傲	ŋaːws (五到切 敖聲 宵1)	
傳	tons (知戀切 專聲 元3)	
傳	don (直攣切 專聲 元3)	
傳	dons (直戀切 專聲 元3)	
傴	qoʔ (於武切 區聲 侯)	
債	ʔsreːɡs (側賣切 朿聲 賜)	
債	ʔsreːɡ (側革切 朿聲 錫)	
傶	ʔslɯːwɢ (將毒切 尗聲 覺2)	
傷	hljaŋ (式羊切 昜聲 陽)	
傷	hljaŋs (式亮切 昜聲 陽)	
傸	shraŋʔ (初丈切 爽聲 陽)	在韻末，集韻併入楚兩切
傺	hr'eds (丑例切 祭聲 祭2)	
傻	sqʰʷraːʔ (沙瓦切 傻聲 魚)	
傻	sqʰʷraːs (所化切 傻聲 魚)	
傾	kʰʷeŋ (去營切 頃聲 耕)	
傿	qans (於建切 焉聲 元1)	
僀	teːds (都計切 帶聲 祭2)	
僁	siːd (先結切 悉聲 質1)	
僁	sid (息七切 悉聲 質1)	
僂	ɡ·roː (落侯切 婁聲 侯)	
僂	ɡ·roːs (盧候切 婁聲 侯)	
僂	ɡ·roʔ (力主切 婁聲 侯)	
僄	pʰew (撫招切 票聲 宵2)	
僄	pʰews (匹妙切 票聲 宵2)	
僅	ɡrɯns (渠遴切 堇聲 文1)	
僆	renʔ (力展切 連聲 元2)	
僆	reːns (郎甸切 連聲 元2)	
僇	rɯwɢs (力救切 翏聲 幽2)	
僇	rɯwɢ (力竹切 翏聲 覺2)	
僉	skʰlam (七廉切 僉聲 談1)	
僊	sen (相然切 遷聲 元2)	說文仙字
僋	l̥ʰuːms (他紺切 今聲 侵3)	
僋	luːms (郎紺切 今聲 侵2)	
僎	sɡronʔ (士免切 巽聲 元3)	
僎	sɡrons (士戀切 巽聲 元3)	
僎	skun (將倫切 巽聲 文2)	
像	ljaŋʔ (徐兩切 象聲 陽)	
