#漢字	音標	解釋
蝖	qʰʷan (況袁切 亘聲 元1)	
蝗	ɡʷaːŋ (胡光切 王聲 陽)	
蝗	ɡʷraːŋ (戸盲切 王聲 陽)	
蝗	ɡʷraːŋs (戸孟切 王聲 陽)	
蝘	qeːnʔ (於殄切 妟聲 元2)	
蝘	qanʔ (於幰切 妟聲 元1)	
蝙	peːn (布玄切 扁聲 元2)	
蝚	mju (耳由切 矛聲 幽1)	
蝛	qul (於非切 威聲 微2)	爾雅作威
蝜	bɯʔ (房久切 負聲 之)	爾雅作負
蝝	lon (與專切 彖聲 元3)	
蝞	mrills (明祕切 眉聲 脂1)	
蝟	ɢuds/ɢluds (于貴切 胃聲 隊2)	説文同彚
蝠	pɯɡ (方六切 畐聲 職)	
蝡	njonʔ (而兖切 耎聲 元3)	集韻或作蠕
蝡	njunʔ (而允切 耎聲 文2)	集韻或作蠕
蝣	lu (以周切 斿聲 幽1)	
蝤	sklu (即由切 酉聲 幽1)	
蝤	sɡlu (自秋切 酉聲 幽1)	
蝥	mruː (莫交切 矛聲 幽1)	
蝥	mu (莫浮切 矛聲 幽1)	說文同蟊
蝥	mo (武夫切 矛聲 侯)	見爾雅
蝥	moɡs (亡遇切 矛聲 竇)	
蝦	qʰraː (虚加切 叚聲 魚)	見楚辭九懷
蝦	ɡraː (胡加切 叚聲 魚)	
蝨	sriɡ (所櫛切 卂聲 質1)	
蝩	doŋ (直容切 重聲 東)	
蝪	l̥ʰaːŋ (吐郎切 昜聲 陽)	
蝬	ʔsoːŋ (子紅切 翪聲 東)	
蝭	teːs (都計切 是聲 支)	見方言
蝭	deː (杜奚切 是聲 支)	見方言
蝮	pʰuɡ (芳福切 复聲 覺1)	
蝯	ɢʷan (雨元切 爰聲 元1)	
蝰	kʰʷeː (苦圭切 圭聲 支)	螝虺之後起字
蝱	mraːŋ (武庚切 亡聲 陽)	
蝲	raːd (盧達切 剌聲 月1)	集韻蟲在下：蠆
蝳	duːɡ (徒沃切 毒聲 覺1)	
蝴	ɡaː (戸吳切 古聲 魚)	胡後起分化字
蝶	l̥ʰeːb (他協切 世聲 盍2)	
蝶	l'eːb (徒協切 世聲 盍2)	見漢詩
蝷	reːɡ (郎擊切 屰聲 錫)	見爾雅
蝸	kroːl (古華切 冎聲 歌3)	
蝸	kʷroːl (古蛙切 冎聲 歌3)	
蝹	quːʔ (烏晧切 昷聲 幽1)	
蝹	qrun (於倫切 昷聲 文2)	原列眞韻見漢賦
蝹	qun (於云切 昷聲 文2)	見漢賦
螂	raːŋ (魯當切 良聲 陽)	蜋後起字見淮南子玉篇
螃	paːŋʔ (北朗切 方聲 陽)	
螃	paːŋs (補曠切 方聲 陽)	
螃	baːŋ (步光切 方聲 陽)	
螄	sri (疏夷切 師聲 脂2)	
螆	shɯs (七吏切 兹聲 之)	同蛓
螇	kʰeː (苦奚切 奚聲 支)	
螇	ɡeː (胡雞切 奚聲 支)	
螉	qloːŋ (烏紅切 公聲 東)	
螋	sru (所鳩切 叟聲 幽1)	
螋	sro (山芻切 叟聲 侯)	
螌	praːn (布還切 般聲 元1)	
融	luŋ (以戎切 蟲聲 終)	
螐	qaː (哀都切 烏聲 魚)	爾雅作烏
螒	ɡaːns (侯旰切 倝聲 元1)	見爾雅
螓	zin (匠鄰切 秦聲 眞1)	
螔	sle (息移切 虒聲 支)	見方言
螔	le (弋支切 虒聲 支)	見爾雅
螕	piː (邊兮切 比聲 脂2)	
螖	ɡruːd (戸八切 骨聲 物2)	
螗	l'aːŋ (徒郎切 庚聲 陽)	
螘	ŋralʔ (魚倚切 豈聲 歌1)	
螘	ŋɯlʔ (魚豈切 豈聲 微1)	
螙	taːs (當故切 螙聲 魚)	說文同蠹
螚	nɯːs (奴代切 能聲 之)	見淮南子
螝	ɡuːls (胡對切 鬼聲 微2)	
螝	krul (居追切 鬼聲 微2)	
螟	meːŋ (莫經切 冥聲 耕)	
螠	qleɡs (於賜切 益聲 賜)	爾雅作縊
螢	ɡʷeːŋ (戸扃切 熒聲 耕)	
螣	l'ɯmʔ (直稔切 朕聲 侵1)	
螣	l'ɯːŋ (徒登切 朕聲 蒸)	
螣	l'ɯːɡ (徒得切 朕聲 職)	
螪	hljaŋ (式羊切 商聲 陽)	見爾雅
螫	qʰjaːɡ (施隻切 赤聲 鐸)	
螬	zluː (昨勞切 曹聲 幽1)	
螭	r̥ʰel (丑知切 离聲 歌2)	
螮	teːds (都計切 帶聲 祭2)	
螯	ŋaːw (五勞切 敖聲 宵1)	
螰	roːɡ (盧谷切 鹿聲 屋)	見爾雅
螱	quds (於胃切 尉聲 隊2)	爾雅異文原從二蟲
螲	tiɡ (陟栗切 至聲 質2)	見方言
螳	daːŋ (徒郎切 尚聲 陽)	
螵	pʰew (撫招切 票聲 宵2)	
螵	bew (符霄切 票聲 宵2)	
螷	be (符支切 卑聲 支)	
螷	breːŋʔ (蒲幸切 卑聲 耕)	同𩶁，集韻爲説文正體
螸	lo (羊朱切 谷聲 侯)	
螹	zam (昨鹽切 斬聲 談1)	
螹	zamʔ (慈染切 斬聲 談1)	
螺	roːl (落戈切 畾聲 歌3)	見論衡說文作蠃
螻	roː (落侯切 婁聲 侯)	
螼	kʰrɯnʔ (弃忍切 堇聲 文1)	
螼	kʰrɯns (羌印切 堇聲 文1)	
螽	tjuŋ (職戎切 冬聲 終)	
螾	lin (翼眞切 寅聲 眞1)	
螾	linʔ (余忍切 寅聲 眞1)	
螿	ʔsaŋ (即良切 爿聲 陽)	見淮南子
蟀	srud (所律切 率聲 物2)	原列質韻
蟁	mɯn (無分切 民聲 文1)	說文雲俗作蚊
蟂	keːw (古堯切 梟聲 宵2)	見漢書
蟃	mons (無販切 曼聲 元3)	見史記
蟄	dib (直立切 執聲 緝2)	
蟅	tjaːɡs (之夜切 庶聲 暮)	
蟅	tjaːɡ (之石切 庶聲 鐸)	原蟲在下注此異體
蟆	mraː (莫霞切 莫聲 魚)	
蟈	kʷrɯːɡ (古獲切 或聲 職)	
蟉	ɡ·rɯw (力幽切 翏聲 幽2)	
蟉	ɡrɯw (渠幽切 翏聲 幽2)	
蟉	ɡrɯwʔ (渠黝切 翏聲 幽2)	
蟊	mu (莫浮切 矛聲 幽1)	
蟋	sid (息七切 悉聲 質1)	見爾雅說文作悉
蟋	srid (所櫛切 悉聲 質1)	
蟍	ril (力脂切 利聲 脂1)	
蟒	maːŋʔ (模朗切 莽聲 陽)	
蟓	ljaŋʔ (徐兩切 象聲 陽)	
蟓	hljaŋs (式亮切 象聲 陽)	
蟗	shlu (七由切 蟗聲 幽1)	見爾雅
蟙	tjɯɡ (之翼切 戠聲 職)	見方言
蟚	braːŋ (薄庚切 彭聲 陽)	
蟛	braːŋ (蒲庚切 彭聲 陽)	蟚注或體
蟜	krewʔ (居夭切 喬聲 宵2)	
蟜	ɡrew (巨嬌切 喬聲 宵2)	
蟝	ɡa (强魚切 巨聲 魚)	見方言
蟟	reːw (落蕭切 尞聲 宵2)	
蟠	baːn (薄官切 番聲 元1)	
蟠	ban (附袁切 番聲 元1)	
蟡	kʷralʔ (過委切 爲聲 歌1)	
蟡	qʷral (於爲切 爲聲 歌1)	
蟢	qʰlɯʔ (虚里切 喜聲 之)	
蟣	kɯlʔ (居狶切 幾聲 微1)	
蟣	ɡɯl (渠希切 幾聲 微1)	
蟤	skron (莊緣切 巽聲 元3)	見九思
蟥	ɡʷaːŋ (胡光切 黄聲 陽)	
蟦	bɯl (符非切 奔聲 微1)	
蟦	bɯlʔ (浮鬼切 奔聲 微1)	
蟦	bɯls (扶沸切 奔聲 微1)	
蟧	raːw (魯刀切 勞聲 宵1)	見爾雅
蟧	reːw (落蕭切 勞聲 宵2)	見方言，集韻同蟟
蟨	kod (居月切 欮聲 月3)	
蟩	kod (居月切 欮聲 月3)	即孑孓之孓
蟪	ɢʷiːds (胡桂切 惠聲 至1)	見莊子
蟫	l'ɯːm (徒含切 覃聲 侵1)	
蟫	lɯm (餘針切 覃聲 侵1)	
蟬	djan (市連切 單聲 元1)	
蟭	ʔsew (即消切 焦聲 宵2)	
蟮	djanʔ (常演切 善聲 元1)	同蟺說文作蟺
蟯	ŋjew (如招切 垚聲 宵2)	
蟯	ʔŋew (於霄切 垚聲 宵2)	
蟰	sɯːw (蘇彫切 肅聲 幽2)	
蟰	sɯwɢ (息逐切 肅聲 覺2)	
蟲	l'uŋ (直弓切 蟲聲 終)	後省作蟲已見漢簡
蟲	l'uŋs (直衆切 蟲聲 終)	
蟴	se (息移切 斯聲 支)	見爾雅
蟶	l̥ʰeŋ (丑貞切 聖聲 耕)	
蟷	taːŋ (都郎切 尚聲 陽)	
蟹	ɡreːʔ (胡買切 解聲 支)	說文蟲在左
蟺	djanʔ (常演切 旦聲 元1)	
蟻	ŋralʔ (魚倚切 我聲 歌1)	同螘本作蛾此見孫子
蟼	kraː (古牙切 敬聲 魚)	見爾雅
蟼	kreŋ (舉卿切 敬聲 耕)	見爾雅
蟼	kreŋʔ (居影切 敬聲 耕)	見爾雅
蟾	tjam (職廉切 詹聲 談1)	
蟾	djam (視占切 詹聲 談1)	
蟿	kʰeːɡs (苦計切 毄聲 賜)	
蟿	kʰiɡs (詰利切 毄聲 質2)	
蠀	shli (取私切 次聲 脂2)	見方言
蠁	qʰaŋʔ (許兩切 鄉聲 陽)	
蠁	qʰaŋs (許亮切 鄉聲 陽)	
蠃	roːl (落戈切 蠃聲 歌3)	說文又義後作螺
蠃	roːlʔ (郎果切 蠃聲 歌3)	
蠅	b·lɯŋ (余陵切 黽聲 蒸)	
蠆	m̥ʰraːds (丑犗切 萬聲 祭1)	
蠇	m·rads (力制切 萬聲 祭1)	說文蠣字
蠈	zɯːɡ (昨則切 則聲 職)	見潛夫論爾雅作賊
蠉	qʰʷen (許緣切 睘聲 元2)	
蠉	qʰʷenʔ (香兖切 睘聲 元2)	
蠊	ɡ·rem (力鹽切 兼聲 談2)	
蠋	doɡ (直錄切 蜀聲 屋)	
蠋	tjoɡ (之欲切 蜀聲 屋)	蜀再轉註
蠌	rlaːɡ (場伯切 睪聲 鐸)	
蠍	qʰad (許竭切 曷聲 月1)	
蠐	zliːl (徂奚切 齊聲 脂1)	
蠐	zlil (疾資切 齊聲 脂1)	原作蟲在齊中，注又音疾兮切，齊韻正作此體
蠑	ɢʷreŋ (永兵切 熒聲 耕)	見爾雅
蠒	keːnʔ (古典切 繭聲 元2)	俗同繭見屍子
蠓	moːŋ (莫紅切 冡聲 東)	
蠓	moːŋʔ (莫孔切 冡聲 東)	
蠕	njo (汝朱切 需聲 侯)	見史記說文作蝡
蠖	qʷaːɡ (烏郭切 蒦聲 鐸)	
蠗	r'eːwɢ (直角切 翟聲 藥2)	
蠙	biːn (部田切 賓聲 眞1)	
蠙	bin (符眞切 賓聲 眞1)	
蠚	hnaːɡ (呵各切 若聲 鐸)	
蠚	n̥ʰaɡ (丑略切 若聲 鐸)	
蠛	meːd (莫結切 蔑聲 月2)	
蠜	ban (附袁切 棥聲 元1)	
蠞	ziːɡ (昨結切 即聲 質2)	
蠟	raːb (盧盍切 巤聲 盍1)	
蠡	reːlʔ (盧啓切 彖聲 歌2)	
蠡	rel (呂支切 彖聲 歌2)	
蠡	roːl (落戈切 彖聲 歌3)	
蠢	tʰjunʔ (尺尹切 屯聲 文2)	
蠣	m·rads (力制切 萬聲 祭1)	說文蠇之後起分化字
蠥	ŋred (魚列切 薛聲 月2)	
蠦	raː (落胡切 虍聲 魚)	
蠩	tja (章魚切 者聲 魚)	
蠪	roːŋ (盧紅切 龍聲 東)	
蠭	pʰoŋ (敷容切 丰聲 東)	
蠮	qiːɡ (烏結切 医聲 質2)	見方言
蠯	breː (薄佳切 卑聲 支)	
蠯	be (符支切 卑聲 支)	同螷
蠯	breːŋʔ (蒲幸切 卑聲 耕)	同𩶁
蠰	naːŋ (奴當切 襄聲 陽)	
蠰	sraŋ (色莊切 襄聲 陽)	
蠰	hnjaŋs (式亮切 襄聲 陽)	
蠰	njaŋʔ (如兩切 襄聲 陽)	
蠱	klaːʔ (公戸切 蠱聲 魚)	
蠲	kʷliːŋ (古玄切 益聲 眞2)	
蠵	ɡʷeː (戸圭切 巂聲 支)	
蠵	ɢʷe (悅吹切 巂聲 支)	
蠶	zluːm (昨含切 兓聲 侵3)	
蠷	ɡʷa (其俱切 瞿聲 魚)	見史記
蠸	ɡron (巨員切 雚聲 元3)	
蠹	taːɡs (當故切 石聲 暮)	
蠻	mroːn (莫還切 龻聲 元3)	金文作龻
蠽	ʔsed (姊列切 截聲 月2)	
蠾	tjoɡ (之欲切 蜀聲 屋)	
蠾	djoɡ (市玉切 蜀聲 屋)	
血	qʰʷiːɡ (呼決切 血聲 質2)	
衁	hmaːŋ (呼光切 亡聲 陽)	
衃	pʰɯ (匹尤切 不聲 之)	
衃	pʰlɯː (芳杯切 不聲 之)	
衄	nuɡ (女六切 丑聲 覺1)	
衄	njuɡ (如六切 丑聲 覺1)	
衅	hmrɯns (許覲切 衅聲 文1)	見禮記
衆	tjuŋ (職戎切 衆聲 終)	
衆	tjuŋs (之仲切 衆聲 終)	甲文象日下三人，金文或改目下，表衆人在監督下勞作
衇	mreːɡ (莫獲切 派聲 錫)	正體血在右此籀文
衈	njɯs (仍吏切 耳聲 之)	
衊	meːd (莫結切 蔑聲 月2)	
行	ɡaːŋ (胡郎切 行聲 陽)	
行	ɡaːŋs (下浪切 行聲 陽)	
行	ɡraːŋ (戸庚切 行聲 陽)	
行	ɡraːŋs (下更切 行聲 陽)	
衍	lanʔ (以淺切 衍聲 元1)	
衍	lans (予線切 衍聲 元1)	
衎	kʰaːnʔ (空旱切 干聲 元1)	
衎	kʰaːns (苦旰切 干聲 元1)	
衒	ɡʷeːn (黄練切 玄聲 元2)	
術	ɦljud (食聿切 术聲 物2)	
衕	doːŋ (徒紅切 同聲 東)	
衕	doːŋs (徒弄切 同聲 東)	
衖	ɡroːŋs (胡絳切 共聲 東)	
街	kreː (古諧切 圭聲 支)	本音佳
街	kreː (古膎切 圭聲 支)	
衙	ŋraː (五加切 五聲 魚)	秦地又牙分化字
衙	ŋa (語居切 五聲 魚)	
衙	ŋaʔ (魚巨切 五聲 魚)	
衝	tʰjoŋ (尺容切 重聲 東)	說文中從童通作此
衞	ɢʷads (于歲切 衛聲 祭1)	金文象四圍巡衛，與韋有異
衡	ɡraːŋ (戸庚切 行聲 陽)	
衢	ɡʷa (其俱切 瞿聲 魚)	
衣	qɯl (於希切 衣聲 微1)	
衣	qɯls (於既切 衣聲 微1)	
衦	kaːnʔ (古旱切 干聲 元1)	
表	prawʔ (陂矯切 表聲 宵1)	
衩	shraːls (楚嫁切 叉聲 歌1)	
衩	shreːls (楚懈切 叉聲 歌2)	
衪	lel (弋支切 也聲 歌2)	
衪	lalʔ (移爾切 也聲 歌1)	見漢書
衫	sroːm (所銜切 彡聲 談3)	
衭	pa (甫無切 夫聲 魚)	
衮	kluːnʔ (古本切 公聲 文2)	
衯	pʰɯn (撫文切 分聲 文1)	撫由府校改
衰	shrol (楚危切 衰聲 歌3)	
衰	srul (所追切 衰聲 微3)	
衱	ɡrab (其輒切 及聲 盍1)	
衱	kab (居怯切 及聲 盍1)	
衲	nuːb (奴答切 內聲 緝3)	
衳	kljoŋ (職容切 公聲 東)	
衴	ʔl'uːmʔ (都感切 冘聲 侵3)	
衵	niɡ (尼質切 日聲 質2)	
衵	njiɡ (人質切 日聲 質2)	
衷	tuŋ (陟弓切 中聲 終)	
衷	tuŋs (陟仲切 中聲 終)	
衸	kreːds (古拜切 介聲 祭2)	
衸	ɡreːds (胡介切 介聲 祭2)	
衹	kje (章移切 氏聲 支)	
衹	ɡe (巨支切 氏聲 支)	
衺	ljaː (似嗟切 牙聲 魚)	
衼	kje (章移切 支聲 支)	衹衼譯saṁɡhāti，同於僧伽
衽	njɯms (汝鴆切 壬聲 侵1)	
衾	kʰrɯm (去金切 今聲 侵1)	
衿	krɯm (居吟切 今聲 侵1)	
袀	kʷin (居勻切 勻聲 眞1)	見呂氏春秋
袁	ɢʷan (雨元切 袁聲 元1)	
袂	mɡʷeds (彌弊切 夬聲 祭2)	
袈	kraːl (古牙切 加聲 歌1)	kasāya譯音見葛洪字苑
袉	l̥ʰaːlʔ (吐可切 它聲 歌1)	
袉	l'aːl (徒河切 它聲 歌1)	
袉	l'aːlʔ (徒可切 它聲 歌1)	
袊	reŋʔ (良郢切 令聲 耕)	見爾雅通作領
袋	l'ɯːɡs (徒耐切 弋聲 代)	同帒
袌	buː (薄襃切 勹聲 幽1)	同袍
袌	buːs (薄報切 勹聲 幽1)	同袍
袍	buː (薄襃切 勹聲 幽1)	
袎	qrɯːws (於敎切 幼聲 幽2)	
袏	ʔslaːls (則箇切 左聲 歌1)	見方言
袑	djewʔ (市沼切 刀聲 宵2)	
袒	daːnʔ (徒旱切 旦聲 元1)	通作綻
袒	rdeːns (丈莧切 旦聲 元2)	
袓	ʔsjaː (子邪切 且聲 魚)	
袓	zaʔ (慈呂切 且聲 魚)	
袔	ɡaːls (胡箇切 可聲 歌1)	
袕	ɡʷliːɡ (胡決切 穴聲 質2)	
袕	ɢʷjiɡ (食聿切 穴聲 質2)	
袖	ljɯwɢs (似祐切 由聲 奧2)	說文俗褎字
袗	kljɯnʔ (章忍切 疹聲 文1)	
袗	kljɯns (章刃切 疹聲 文1)	
袚	poːd (北末切 犮聲 月3)	
袛	tiːl (都奚切 氐聲 脂1)	
袜	maːd (莫撥切 末聲 月1)	
袝	bos (符遇切 付聲 侯)	
袞	kluːnʔ (古本切 公聲 文2)	袞後出或體
袠	l'iɡ (直一切 失聲 質2)	說文同帙
袡	njam (汝鹽切 冉聲 談1)	
袢	ban (附袁切 半聲 元3)	
袣	lebs (餘制切 世聲 蓋2)	見漢書
袤	mus (莫候切 矛聲 幽1)	
袥	tʰaːɡ (他各切 石聲 鐸)	
袦	ŋr'oːd (女刮切 出聲 月3)	
袨	ɡʷeːn (黄練切 玄聲 元2)	
袪	kʰa (去魚切 去聲 魚)	
被	bralʔ (皮彼切 皮聲 歌1)	
被	brals (平義切 皮聲 歌1)	
袲	naːlʔ (奴可切 多聲 歌1)	
袲	l̥ʰjalʔ (尺氏切 多聲 歌1)	同袳
袲	lal (弋支切 多聲 歌1)	
袳	l̥ʰjalʔ (尺氏切 多聲 歌1)	
袴	kʰʷaːs (苦故切 于聲 魚)	見方言同說文絝
袵	njɯmʔ (如甚切 壬聲 侵1)	
袷	kruːb (古洽切 合聲 緝3)	
袷	ŋkob (居怯切 合聲 盍3)	同衱
袸	zlɯːns (在甸切 存聲 文1)	
袸	zluːn (徂尊切 存聲 文1)	
袹	mbraːɡ (莫白切 白聲 鐸)	
袺	kriːd (古黠切 吉聲 質1)	
袺	kiːd (古屑切 吉聲 質1)	
袼	ɡ·raːɡ (盧各切 各聲 鐸)	見方言
袼	klaːɡ (古落切 各聲 鐸)	見禮記
袽	na (女余切 女聲 魚)	見易
袾	to (陟輸切 朱聲 侯)	
袾	tʰjo (昌朱切 朱聲 侯)	
袿	kʷeː (古攜切 圭聲 支)	
裀	qin (於眞切 因聲 眞1)	
裁	zlɯː (昨哉切 𢦏聲 之)	
裁	zlɯːs (昨代切 𢦏聲 之)	
裂	red (良薛切 列聲 月2)	
裋	djoʔ (臣庾切 豆聲 侯)	
裌	kreːb (古洽切 夾聲 盍2)	同袷實夾轉註分化字
裍	kʰuːnʔ (苦本切 困聲 文2)	
裎	l̥ʰeŋʔ (丑郢切 呈聲 耕)	
裎	rleŋ (直貞切 呈聲 耕)	
裏	rɯʔ (良士切 里聲 之)	
裒	bu (薄侯切 裒聲 幽)	
裓	kɯːɡ (古得切 戒聲 職)	
裔	leds (餘制切 裔聲 祭2)	
裕	loɡs (羊戍切 谷聲 竇)	
裖	tjɯnʔ (章忍切 辰聲 文1)	同袗
裗	ru (力求切 流聲 幽1)	見爾雅
裘	ɡʷɯ (巨鳩切 裘聲 之)	甲文象形，後加又聲，初非求聲
裙	ɡlun (渠云切 君聲 文2)	裠注或體見釋名
裛	qrab (於輒切 邑聲 盍1)	
裛	qab (於業切 邑聲 盍1)	
裛	qrɯb (於汲切 邑聲 緝1)	
補	paːʔ (博古切 甫聲 魚)	
裝	ʔsraŋ (側羊切 爿聲 陽)	
裝	ʔsraŋs (側亮切 爿聲 陽)	
裞	l̥ʰoːds (他外切 兌聲 祭3)	
裞	hljods (舒芮切 兌聲 祭3)	
裟	sraːl (所加切 沙聲 歌1)	梵譯kasāya，原從毛，葛洪字苑改從衣
裠	ɡlun (渠云切 君聲 文2)	同帬
裧	l̥ʰaːmʔ (吐敢切 炎聲 談1)	
裧	l̥ʰjam (處占切 炎聲 談1)	
裧	l̥ʰjams (昌豔切 炎聲 談1)	同幨襜
裨	pe (府移切 卑聲 支)	
裨	be (符支切 卑聲 支)	
裫	qʷiːns (烏縣切 淵聲 眞1)	
裮	tʰjaŋ (尺良切 昌聲 陽)	
裯	tuːw (都牢切 周聲 幽2)	
裯	dɯw (直由切 周聲 幽2)	
裯	do (直誅切 周聲 侯)	
裰	toːd (丁括切 叕聲 月3)	
裱	prawʔ (彼小切 表聲 宵1)	
裱	praws (方廟切 表聲 宵1)	
裳	djaŋ (市羊切 尚聲 陽)	
裴	buːl (薄回切 非聲 微1)	
裴	bɯl (符非切 非聲 微1)	
裶	pʰɯl (芳非切 非聲 微1)	
裷	kʰonʔ (去阮切 卷聲 元3)	
裷	qon (於袁切 卷聲 元3)	
裸	ɡ·roːlʔ (郎果切 果聲 歌3)	
裹	kloːlʔ (古火切 果聲 歌3)	
裹	kloːls (古臥切 果聲 歌3)	
裺	qromʔ (衣儉切 奄聲 談3)	
裺	qoms (於劒切 奄聲 談3)	原列梵韻依王韻改釅
裻	ʔl'uːwɢ (冬毒切 尗聲 覺1)	
裻	sluːwɢ (先篤切 尗聲 覺1)	
裼	sleːɡ (先擊切 易聲 錫)	
製	kjeds (征例切 制聲 祭2)	
裾	ka (九魚切 古聲 魚)	
褆	deː (杜奚切 是聲 支)	
褆	deʔ (池爾切 是聲 支)	
褆	djeʔ (承紙切 是聲 支)	
複	buɡs (扶富切 复聲 奧1)	
複	puɡ (方六切 复聲 覺1)	
褈	doŋ (直容切 重聲 東)	通作重
褈	tʰjoŋ (尺容切 重聲 東)	
褉	qʰeːd (虎結切 丯聲 月2)	
褊	penʔ (方緬切 扁聲 元2)	
褋	l'eːb (徒協切 世聲 盍2)	
褌	kuːn (古渾切 軍聲 文2)	
褍	toːlʔ (丁果切 耑聲 歌3)	
褍	toːn (多官切 耑聲 元3)	
褎	ljɯws (似祐切 褎聲 幽2)	袖注或體，說文正體，爪禾乃秀省聲非穗聲
褎	lɯws (余救切 褎聲 幽2)	
褐	ɡaːd (胡葛切 曷聲 月1)	
褑	ɢʷans (王眷切 爰聲 元1)	
褓	puːʔ (博抱切 保聲 幽1)	
褔	pʰɯɡs (敷救切 畐聲 代)	
褕	low (餘昭切 俞聲 宵3)	
褕	lo (羊朱切 俞聲 侯)	
褖	l̥ʰoːns (通貫切 彖聲 元3)	見儀禮
褗	qanʔ (於幰切 妟聲 元1)	
褗	qans (於建切 妟聲 元1)	
褘	qʰʷɯl (許歸切 韋聲 微2)	
褚	taʔ (丁呂切 者聲 魚)	
褚	tʰaʔ (丑呂切 者聲 魚)	
褞	qunʔ (於粉切 昷聲 文2)	
褠	koː (古侯切 冓聲 侯)	
褡	tuːb (都合切 合聲 緝3)	
褡	toːb (都榼切 合聲 盍1)	
褢	ɡruːl (戸乖切 鬼聲 微2)	
褣	loŋ (餘封切 谷聲 東)	見方言
褥	nuːɡ (內沃切 辱聲 覺1)	
褥	njoɡ (而蜀切 辱聲 屋)	
褦	nɯːs (乃代切 能聲 之)	
褧	kʰʷeːŋʔ (口迥切 耿聲 耕)	
褨	slaːlʔ (蘇可切 左聲 歌1)	
褪	n̥ʰuːns (土困切 退聲 文2)	退晚起對轉分化字，韻會土困切
褫	l̥ʰɯʔ (敕里切 虒聲 之)	
褫	l̥ʰeʔ (敕豸切 虒聲 支)	
褫	l'e (直離切 虒聲 支)	
褫	l'eʔ (池爾切 虒聲 支)	
褭	neːwʔ (奴鳥切 褭聲 宵2)	
褮	qreːŋ (烏莖切 熒聲 耕)	
褮	qʷeŋ (於營切 熒聲 耕)	
褮	ɢʷeːŋ (戸扃切 熒聲 耕)	
褯	zljaːɡs (慈夜切 庶聲 御)	與藉同源
褰	kʰran (去乾切 寒聲 元1)	
褱	ɡruːl (戸乖切 眔聲 微2)	金文說文眔聲
褱	ɡruːl (戸乖切 褱聲 微2)	本從眔l'uub聲
褲	kʰʷaːs (苦故切 于聲 魚)	袴今字
褵	rel (呂支切 离聲 歌2)	
褶	ʔljob (之涉切 習聲 盍3)	襵摺晚起分化字
褶	l'ɯːb (徒協切 習聲 緝1)	見禮記
褶	ljub (似入切 習聲 緝3)	
褶	ɦljub (是執切 習聲 緝3)	
褷	srel (所宜切 徙聲 歌2)	同襹
褸	roː (落侯切 婁聲 侯)	
褸	roʔ (力主切 婁聲 侯)	
褹	ŋr'eːds (女介切 埶聲 祭2)	見方言
褹	ŋeds (魚祭切 埶聲 祭2)	見方言
褺	diːb (徒協切 執聲 緝2)	
褻	sŋed (私列切 埶聲 月2)	
褽	quds (於胃切 尉聲 隊2)	
褾	pewʔ (方小切 票聲 宵2)	
褿	zluː (昨勞切 曹聲 幽1)	
襀	ʔseɡ (資昔切 朿聲 錫)	
襁	kaŋʔ (居兩切 强聲 陽)	
襃	puː (博毛切 保聲 幽1)	
襄	snaŋ (息良切 襄聲 陽)	從衣，中從饟之初文得聲
襆	poːɡ (博木切 菐聲 屋)	同纀
襆	boɡ (房玉切 菐聲 屋)	同襆
襈	sɡrons (士戀切 巽聲 元3)	士由七校正
襈	ɡrons (渠卷切 巽聲 元3)	
襉	kreːnʔ (古限切 閒聲 元2)	原右從簡
襉	kreːns (古莧切 閒聲 元2)	
襊	shoːds (麤最切 取聲 祭3)	
襊	shoːd (倉括切 取聲 月3)	
襋	krɯɡ (紀力切 棘聲 職)	
襌	taːn (都寒切 單聲 元1)	
襎	ban (附袁切 番聲 元1)	見方言
襏	paːd (北末切 發聲 月1)	
襐	ljaŋʔ (徐兩切 象聲 陽)	
襑	l̥ʰuːmʔ (他感切 尋聲 侵3)	
襑	ljum (徐林切 尋聲 侵3)	
襒	beːd (蒲結切 敝聲 月2)	
襓	ŋjew (如招切 垚聲 宵2)	見禮記
襖	quːʔ (烏晧切 奧聲 幽1)	
襗	l'aːɡ (徒落切 睪聲 鐸)	
襗	rlaːɡ (場伯切 睪聲 鐸)	
襗	laːɡ (羊益切 睪聲 鐸)	
襘	koːbs (古外切 會聲 蓋3)	
襚	ljuds (徐醉切 遂聲 隊3)	
襛	noŋ (女容切 農聲 東)	
襛	njoŋ (而容切 農聲 東)	
襜	tʰjam (處占切 詹聲 談1)	
襜	tʰjams (昌豔切 詹聲 談1)	同幨
襞	peɡ (必益切 辟聲 錫)	
襟	krɯm (居吟切 林聲 侵1)	
襠	taːŋ (都郎切 尚聲 陽)	
襡	toːʔ (當口切 蜀聲 侯)	
襡	toːɡs (都豆切 蜀聲 竇)	
襡	doːʔ (徒口切 蜀聲 侯)	
襡	doːɡ (徒谷切 蜀聲 屋)	
襡	djoɡ (市玉切 蜀聲 屋)	
襢	daːnʔ (徒旱切 旦聲 元1)	同袒
襢	tanʔ (知演切 旦聲 元1)	
襢	tans (陟扇切 旦聲 元1)	同展
襣	bids (毗至切 畀聲 至1)	
襤	ɡ·raːm (魯甘切 監聲 談1)	
襦	njo (人朱切 需聲 侯)	
襩	ɦljoɡ (市玉切 儥聲 屋)	同䙱，又說文同襱
襪	mad (望發切 蔑聲 月1)	同韤見釋名
襫	hjaɡ (施隻切 奭聲 鐸)	見國語
襬	pral (彼爲切 罷聲 歌1)	
襬	pʰrals (披義切 罷聲 歌1)	
襭	ɡiːd (胡結切 吉聲 質1)	
襮	poːwɢ (補各切 暴聲 藥3)	
襮	poːwɢ (博沃切 暴聲 覺1)	
襯	shrins (初覲切 辛聲 眞2)	
襱	roːŋ (盧紅切 龍聲 東)	
襱	roːŋʔ (力董切 龍聲 東)	
襱	r'oŋʔ (直隴切 龍聲 東)	
襲	ljɯb (似入切 龖聲 緝1)	
襳	sem (息廉切 韱聲 談2)	
襳	srem (史炎切 韱聲 談2)	見張衡賦
襳	srim (所今切 韱聲 侵2)	見張衡賦
襵	nteb (陟葉切 聶聲 盍2)	
襵	ʔnjeb (之涉切 聶聲 盍2)	後作褶
襶	tɯːɡs (丁代切 弋聲 代)	戴或弋聲
襸	ʔsaːns (則旰切 贊聲 元1)	
襹	srel (所宜切 丽聲 歌2)	見漢賦
襹	srels (所寄切 丽聲 歌2)	見漢賦
襺	keːnʔ (古典切 繭聲 元2)	
襻	pʰraːns (普患切 棥聲 元1)	
襾	qraːs (衣嫁切 襾聲 魚)	
西	sɯːl (先稽切 西聲 微1)	
覀	qʰraːʔ (許下切 襾聲 魚)	
要	qew (於霄切 要聲 宵2)	
要	qews (於笑切 要聲 宵2)	
覂	poŋʔ (方勇切 乏聲 東)	
覃	l'ɯːm (徒含切 覃聲 侵1)	
覆	pʰuɡs (敷救切 复聲 奧1)	
覆	buɡs (扶富切 复聲 奧1)	
覆	pʰɯːɡ (匹北切 复聲 職)	
覆	pʰuɡ (芳福切 复聲 覺1)	
覈	ɡleːd (胡結切 敫聲 月2)	
覈	ɡreːɡ (下革切 敫聲 錫)	
見	keːns (古電切 見聲 元2)	
見	ɡeːns (胡甸切 見聲 元2)	
覎	qaːms (於劒切 覎聲 談1)	原列梵韻依王韻改釅
規	kʷel (居隋切 規聲 歌3)	小徐見聲，與圜同源；古亦同窺，夫或癸省文
覒	maːws (莫報切 毛聲 宵1)	
覓	meːɡ (莫狄切 覓聲 錫)	集韻同覛
覕	pliŋs (必刃切 必聲 眞2)	
覕	mbliːɡ (莫結切 必聲 質2)	
視	ɡljilʔ (承矢切 示聲 脂1)	
視	ɡljils (常利切 示聲 脂1)	
視	ɢljils (神至切 示聲 脂1)	同眎依余校王韻又神至反加
覗	slɯ (息兹切 司聲 之)	
覗	slɯs (相吏切 司聲 之)	
覘	tems (丑豔切 占聲 談2)	
覘	tʰem (丑廉切 占聲 談2)	
覛	mreːɡ (莫獲切 派聲 錫)	
覛	meːɡ (莫狄切 派聲 錫)	
覜	l̥ʰeːws (他弔切 兆聲 宵2)	
覝	ram (力鹽切 覝聲 談1)	廉察本字讀若鎌
覞	laws (弋照切 覞聲 宵1)	
覡	ɡeːɡ (胡狄切 覡聲 錫)	或雲見亦聲
覢	hljamʔ (失冉切 炎聲 談1)	
覣	qrol (於爲切 委聲 歌3)	
覦	lo (羊朱切 俞聲 侯)	
覦	los (羊戍切 俞聲 侯)	
覩	taːʔ (當古切 者聲 魚)	古文睹
親	shin (七人切 辛聲 眞2)	說文親（同榛）聲
親	shins (七遴切 辛聲 眞2)	
覬	krɯls (几利切 豈聲 微1)	
覭	meːŋ (莫經切 冥聲 耕)	
覭	meːɡ (莫狄切 冥聲 錫)	
覮	pqʰʷeːŋ (普丁切 熒聲 耕)	淮南子也從目
覯	koːs (古候切 冓聲 侯)	
覰	shas (七慮切 且聲 魚)	
覱	ʔsraːms (子鑑切 斬聲 談1)	四聲韻譜改債懺切
覲	ɡrɯns (渠遴切 堇聲 文1)	堇轉註字
覴	tʰɯŋs (丑證切 登聲 蒸)	
覵	kreːn (古閑切 閒聲 元2)	
覵	kreːns (古莧切 閒聲 元2)	
覵	pkrenʔ (方免切 閒聲 元2)	
覷	shas (七慮切 且聲 魚)	覰今字，虘旁俗訛虛
覹	mrɯl (武悲切 微聲 微1)	同矀
覺	kruːɡs (古孝切 學聲 奧1)	
覺	kruːɡ (古岳切 學聲 覺1)	
覼	roːl (落戈切 亂聲 歌3)	覶俗形譌
覽	ɡ·raːmʔ (盧敢切 監聲 談1)	
覿	l'juːɡ (徒歷切 儥聲 覺1)	
觀	koːn (古丸切 雚聲 元3)	
觀	koːns (古玩切 雚聲 元3)	
角	kroːɡ (古岳切 角聲 屋)	
角	ɡ·roːɡ (盧谷切 角聲 屋)	
觓	ɡrɯw (渠幽切 丩聲 幽2)	
觔	kɯn (舉欣切 觔聲 文1)	筋論衡作觔，廣韻集韻原有竹頭
觕	shlaː (倉胡切 觕聲 魚)	
觕	zlaːʔ (徂古切 觕聲 魚)	
觕	tʰjoɡ (尺玉切 蜀聲 屋)	觸字古文，古籍牛在下
觖	kʰʷeds (窺瑞切 夬聲 祭2)	
觖	kʷeːd (古穴切 夬聲 月2)	見淮南子
觘	sm̥ʰreːw (楚交切 小聲 宵2)	
觘	sm̥ʰreːws (初敎切 小聲 宵2)	
觚	kʷaː (古胡切 瓜聲 魚)	
觛	taːnʔ (多旱切 旦聲 元1)	
觛	taːns (得按切 旦聲 元1)	
觛	daːnʔ (徒旱切 旦聲 元1)	
觜	ʔse (即移切 此聲 支)	
觜	ʔse (姊規切 此聲 支)	原姊宜切校本依切韻改。合口實後起
觜	ʔseʔ (即委切 此聲 支)	合口後起
觝	tiːlʔ (都禮切 氐聲 脂1)	同牴見淮南子
觟	ɡʷraːʔ (胡瓦切 圭聲 魚)	
觠	krons (居倦切 龹聲 元3)	
觠	ɡron (巨員切 龹聲 元3)	
觡	kraːɡ (古伯切 各聲 鐸)	
觢	ɡjeds (時制切 丯聲 祭2)	
解	kreːʔ (佳買切 解聲 支)	
解	kreːs (古隘切 解聲 支)	
解	ɡreːʔ (胡買切 解聲 支)	
解	ɡreːs (胡懈切 解聲 支)	
觤	krolʔ (過委切 危聲 歌3)	
觥	kʷraːŋ (古橫切 光聲 陽)	
觩	ɡu (渠幽切 求聲 幽1)	
觪	seŋ (息營切 辛聲 耕)	
觬	ŋeː (五稽切 兒聲 支)	
觬	ŋeːʔ (研啓切 兒聲 支)	
觭	kʰral (去奇切 奇聲 歌1)	
觭	kʰralʔ (墟彼切 奇聲 歌1)	
觰	rtaːʔ (都賈切 者聲 魚)	
觰	rtaː (陟加切 者聲 魚)	
觱	mpid (卑吉切 觱聲 質1)	
觱	ɦmɯd (王勿切 觱聲 物1)	
觳	kʰroːɡ (苦角切 殻聲 屋)	
